Director,Genre,IMDB_Rating,Overview,Poster_Link,Released_Year,Runtime,Series_Title,Star1,Star2,Star3,Star4,_id
Christopher Nolan,"Action, Crime, Drama",9,"When the menace known as the Joker wreaks havoc and chaos on the people of Gotham, Batman must accept one of the greatest psychological and physical tests of his ability to fight injustice.","https://m.media-amazon.com/images/M/MV5BMTMxNTMwODM0NF5BMl5BanBnXkFtZTcwODAyMTk2Mw@@._V1_UX67_CR0,0,67,98_AL_.jpg",2008,152 min,The Dark Knight,Christian Bale,Heath Ledger,Aaron Eckhart,Michael Caine,646bbde4cbb1b4e99b76a7ad
Francis Ford Coppola,"Crime, Drama",9,"The early life and career of Vito Corleone in 1920s New York City is portrayed, while his son, Michael, expands and tightens his grip on the family crime syndicate.","https://m.media-amazon.com/images/M/MV5BMWMwMGQzZTItY2JlNC00OWZiLWIyMDctNDk2ZDQ2YjRjMWQ0XkEyXkFqcGdeQXVyNzkwMjQ5NzM@._V1_UY98_CR1,0,67,98_AL_.jpg",1974,202 min,The Godfather: Part II,Al Pacino,Robert De Niro,Robert Duvall,Diane Keaton,646bbde4cbb1b4e99b76a7ae
Steven Spielberg,"Biography, Drama, History",8.9,"In German-occupied Poland during World War II, industrialist Oskar Schindler gradually becomes concerned for his Jewish workforce after witnessing their persecution by the Nazis.","https://m.media-amazon.com/images/M/MV5BNDE4OTMxMTctNmRhYy00NWE2LTg3YzItYTk3M2UwOTU5Njg4XkEyXkFqcGdeQXVyNjU0OTQ0OTY@._V1_UX67_CR0,0,67,98_AL_.jpg",1993,195 min,"Schindler's List",Liam Neeson,Ralph Fiennes,Ben Kingsley,Caroline Goodall,646bbde4cbb1b4e99b76a7b2
Sergio Leone,Western,8.8,A bounty hunting scam joins two men in an uneasy alliance against a third in a race to find a fortune in gold buried in a remote cemetery.,"https://m.media-amazon.com/images/M/MV5BOTQ5NDI3MTI4MF5BMl5BanBnXkFtZTgwNDQ4ODE5MDE@._V1_UX67_CR0,0,67,98_AL_.jpg",1966,161 min,"Il buono, il brutto, il cattivo",Clint Eastwood,Eli Wallach,Lee Van Cleef,Aldo Giuffrè,646bbde4cbb1b4e99b76a7b7
Peter Jackson,"Action, Adventure, Drama",8.7,"While Frodo and Sam edge closer to Mordor with the help of the shifty Gollum, the divided fellowship makes a stand against Sauron's new ally, Saruman, and his hordes of Isengard.","https://m.media-amazon.com/images/M/MV5BZGMxZTdjZmYtMmE2Ni00ZTdkLWI5NTgtNjlmMjBiNzU2MmI5XkEyXkFqcGdeQXVyNjU0OTQ0OTY@._V1_UX67_CR0,0,67,98_AL_.jpg",2002,179 min,The Lord of the Rings: The Two Towers,Elijah Wood,Ian McKellen,Viggo Mortensen,Orlando Bloom,646bbde4cbb1b4e99b76a7b8
Martin Scorsese,"Biography, Crime, Drama",8.7,"The story of Henry Hill and his life in the mob, covering his relationship with his wife Karen Hill and his mob partners Jimmy Conway and Tommy DeVito in the Italian-American crime syndicate.","https://m.media-amazon.com/images/M/MV5BY2NkZjEzMDgtN2RjYy00YzM1LWI4ZmQtMjIwYjFjNmI3ZGEwXkEyXkFqcGdeQXVyNzkwMjQ5NzM@._V1_UX67_CR0,0,67,98_AL_.jpg",1990,146 min,Goodfellas,Robert De Niro,Ray Liotta,Joe Pesci,Lorraine Bracco,646bbde4cbb1b4e99b76a7ba
Bong Joon Ho,"Comedy, Drama, Thriller",8.6,Greed and class discrimination threaten the newly formed symbiotic relationship between the wealthy Park family and the destitute Kim clan.,"https://m.media-amazon.com/images/M/MV5BYWZjMjk3ZTItODQ2ZC00NTY5LWE0ZDYtZTI3MjcwN2Q5NTVkXkEyXkFqcGdeQXVyODk4OTc3MTY@._V1_UX67_CR0,0,67,98_AL_.jpg",2019,132 min,Gisaengchung,Kang-ho Song,Lee Sun-kyun,Cho Yeo-jeong,Choi Woo-sik,646bbde4cbb1b4e99b76a7be
Sudha Kongara,Drama,8.6,"Nedumaaran Rajangam ""Maara"" sets out to make the common man fly and in the process takes on the world's most capital intensive industry and several enemies who stand in his way.","https://m.media-amazon.com/images/M/MV5BOTc2ZTlmYmItMDBhYS00YmMzLWI4ZjAtMTI5YTBjOTFiMGEwXkEyXkFqcGdeQXVyODE5NzE3OTE@._V1_UY98_CR0,0,67,98_AL_.jpg",2020,153 min,Soorarai Pottru,Suriya,Madhavan,Paresh Rawal,Aparna Balamurali,646bbde4cbb1b4e99b76a7bf
Fernando Meirelles,"Crime, Drama",8.6,"In the slums of Rio, two kids' paths diverge as one struggles to become a photographer and the other a kingpin.","https://m.media-amazon.com/images/M/MV5BOTMwYjc5ZmItYTFjZC00ZGQ3LTlkNTMtMjZiNTZlMWQzNzI5XkEyXkFqcGdeQXVyNzkwMjQ5NzM@._V1_UX67_CR0,0,67,98_AL_.jpg",2002,130 min,Cidade de Deus,Kátia Lund,Alexandre Rodrigues,Leandro Firmino,Matheus Nachtergaele,646bbde4cbb1b4e99b76a7c1
Hayao Miyazaki,"Animation, Adventure, Family",8.6,"During her family's move to the suburbs, a sullen 10-year-old girl wanders into a world ruled by gods, witches, and spirits, and where humans are changed into beasts.","https://m.media-amazon.com/images/M/MV5BMjlmZmI5MDctNDE2YS00YWE0LWE5ZWItZDBhYWQ0NTcxNWRhXkEyXkFqcGdeQXVyMTMxODk2OTU@._V1_UX67_CR0,0,67,98_AL_.jpg",2001,125 min,Sen to Chihiro no kamikakushi,Daveigh Chase,Suzanne Pleshette,Miyu Irino,Rumi Hiiragi,646bbde4cbb1b4e99b76a7c2
Steven Spielberg,"Drama, War",8.6,"Following the Normandy Landings, a group of U.S. soldiers go behind enemy lines to retrieve a paratrooper whose brothers have been killed in action.","https://m.media-amazon.com/images/M/MV5BZjhkMDM4MWItZTVjOC00ZDRhLThmYTAtM2I5NzBmNmNlMzI1XkEyXkFqcGdeQXVyNDYyMDk5MTU@._V1_UX67_CR0,0,67,98_AL_.jpg",1998,169 min,Saving Private Ryan,Tom Hanks,Matt Damon,Tom Sizemore,Edward Burns,646bbde4cbb1b4e99b76a7c3
David Fincher,"Crime, Drama, Mystery",8.6,"Two detectives, a rookie and a veteran, hunt a serial killer who uses the seven deadly sins as his motives.","https://m.media-amazon.com/images/M/MV5BOTUwODM5MTctZjczMi00OTk4LTg3NWUtNmVhMTAzNTNjYjcyXkEyXkFqcGdeQXVyNjU0OTQ0OTY@._V1_UX67_CR0,0,67,98_AL_.jpg",1995,127 min,Se7en,Morgan Freeman,Brad Pitt,Kevin Spacey,Andrew Kevin Walker,646bbde4cbb1b4e99b76a7c6
Jonathan Demme,"Crime, Drama, Thriller",8.6,"A young F.B.I. cadet must receive the help of an incarcerated and manipulative cannibal killer to help catch another serial killer, a madman who skins his victims.","https://m.media-amazon.com/images/M/MV5BNjNhZTk0ZmEtNjJhMi00YzFlLWE1MmEtYzM1M2ZmMGMwMTU4XkEyXkFqcGdeQXVyNjU0OTQ0OTY@._V1_UX67_CR0,0,67,98_AL_.jpg",1991,118 min,The Silence of the Lambs,Jodie Foster,Anthony Hopkins,Lawrence A. Bonney,Kasi Lemmons,646bbde4cbb1b4e99b76a7c7
George Lucas,"Action, Adventure, Fantasy",8.6,"Luke Skywalker joins forces with a Jedi Knight, a cocky pilot, a Wookiee and two droids to save the galaxy from the Empire's world-destroying battle station, while also attempting to rescue Princess Leia from the mysterious Darth Vader.","https://m.media-amazon.com/images/M/MV5BNzVlY2MwMjktM2E4OS00Y2Y3LWE3ZjctYzhkZGM3YzA1ZWM2XkEyXkFqcGdeQXVyNzkwMjQ5NzM@._V1_UX67_CR0,0,67,98_AL_.jpg",1977,121 min,Star Wars,Mark Hamill,Harrison Ford,Carrie Fisher,Alec Guinness,646bbde4cbb1b4e99b76a7c8
Masaki Kobayashi,"Action, Drama, Mystery",8.6,"When a ronin requesting seppuku at a feudal lord's palace is told of the brutal suicide of another ronin who previously visited, he reveals how their pasts are intertwined - and in doing so challenges the clan's integrity.","https://m.media-amazon.com/images/M/MV5BYjBmYTQ1NjItZWU5MS00YjI0LTg2OTYtYmFkN2JkMmNiNWVkXkEyXkFqcGdeQXVyMTMxMTY0OTQ@._V1_UY98_CR2,0,67,98_AL_.jpg",1962,133 min,Seppuku,Tatsuya Nakadai,Akira Ishihama,Shima Iwashita,Tetsurô Tanba,646bbde4cbb1b4e99b76a7c9
Akira Kurosawa,"Action, Adventure, Drama",8.6,A poor village under attack by bandits recruits seven unemployed samurai to help them defend themselves.,"https://m.media-amazon.com/images/M/MV5BOWE4ZDdhNmMtNzE5ZC00NzExLTlhNGMtY2ZhYjYzODEzODA1XkEyXkFqcGdeQXVyNTAyODkwOQ@@._V1_UY98_CR1,0,67,98_AL_.jpg",1954,207 min,Shichinin no samurai,Toshirô Mifune,Takashi Shimura,Keiko Tsushima,Yukiko Shimazaki,646bbde4cbb1b4e99b76a7ca
Frank Capra,"Drama, Family, Fantasy",8.6,An angel is sent from Heaven to help a desperately frustrated businessman by showing him what life would have been like if he had never existed.,"https://m.media-amazon.com/images/M/MV5BZjc4NDZhZWMtNGEzYS00ZWU2LThlM2ItNTA0YzQ0OTExMTE2XkEyXkFqcGdeQXVyNjUwMzI2NzU@._V1_UY98_CR0,0,67,98_AL_.jpg",1946,130 min,"It's a Wonderful Life",James Stewart,Donna Reed,Lionel Barrymore,Thomas Mitchell,646bbde4cbb1b4e99b76a7cb
Todd Phillips,"Crime, Drama, Thriller",8.5,"In Gotham City, mentally troubled comedian Arthur Fleck is disregarded and mistreated by society. He then embarks on a downward spiral of revolution and bloody crime. This path brings him face-to-face with his alter-ego: the Joker.","https://m.media-amazon.com/images/M/MV5BNGVjNWI4ZGUtNzE0MS00YTJmLWE0ZDctN2ZiYTk2YmI3NTYyXkEyXkFqcGdeQXVyMTkxNjUyNQ@@._V1_UX67_CR0,0,67,98_AL_.jpg",2019,122 min,Joker,Joaquin Phoenix,Robert De Niro,Zazie Beetz,Frances Conroy,646bbde4cbb1b4e99b76a7cc
Damien Chazelle,"Drama, Music",8.5,"A promising young drummer enrolls at a cut-throat music conservatory where his dreams of greatness are mentored by an instructor who will stop at nothing to realize a student's potential.","https://m.media-amazon.com/images/M/MV5BOTA5NDZlZGUtMjAxOS00YTRkLTkwYmMtYWQ0NWEwZDZiNjEzXkEyXkFqcGdeQXVyMTMxODk2OTU@._V1_UX67_CR0,0,67,98_AL_.jpg",2014,106 min,Whiplash,Miles Teller,J.K. Simmons,Melissa Benoist,Paul Reiser,646bbde4cbb1b4e99b76a7cd
Olivier Nakache,"Biography, Comedy, Drama",8.5,"After he becomes a quadriplegic from a paragliding accident, an aristocrat hires a young man from the projects to be his caregiver.","https://m.media-amazon.com/images/M/MV5BMTYxNDA3MDQwNl5BMl5BanBnXkFtZTcwNTU4Mzc1Nw@@._V1_UX67_CR0,0,67,98_AL_.jpg",2011,112 min,The Intouchables,Éric Toledano,François Cluzet,Omar Sy,Anne Le Ny,646bbde4cbb1b4e99b76a7ce
Christopher Nolan,"Drama, Mystery, Sci-Fi",8.5,"After a tragic accident, two stage magicians engage in a battle to create the ultimate illusion while sacrificing everything they have to outwit each other.","https://m.media-amazon.com/images/M/MV5BMjA4NDI0MTIxNF5BMl5BanBnXkFtZTYwNTM0MzY2._V1_UX67_CR0,0,67,98_AL_.jpg",2006,130 min,The Prestige,Christian Bale,Hugh Jackman,Scarlett Johansson,Michael Caine,646bbde4cbb1b4e99b76a7cf
Martin Scorsese,"Crime, Drama, Thriller",8.5,An undercover cop and a mole in the police attempt to identify each other while infiltrating an Irish gang in South Boston.,"https://m.media-amazon.com/images/M/MV5BMTI1MTY2OTIxNV5BMl5BanBnXkFtZTYwNjQ4NjY3._V1_UX67_CR0,0,67,98_AL_.jpg",2006,151 min,The Departed,Leonardo DiCaprio,Matt Damon,Jack Nicholson,Mark Wahlberg,646bbde4cbb1b4e99b76a7d0
Roman Polanski,"Biography, Drama, Music",8.5,A Polish Jewish musician struggles to survive the destruction of the Warsaw ghetto of World War II.,"https://m.media-amazon.com/images/M/MV5BOWRiZDIxZjktMTA1NC00MDQ2LWEzMjUtMTliZmY3NjQ3ODJiXkEyXkFqcGdeQXVyNjU0OTQ0OTY@._V1_UY98_CR2,0,67,98_AL_.jpg",2002,150 min,The Pianist,Adrien Brody,Thomas Kretschmann,Frank Finlay,Emilia Fox,646bbde4cbb1b4e99b76a7d1
Ridley Scott,"Action, Adventure, Drama",8.5,A former Roman General sets out to exact vengeance against the corrupt emperor who murdered his family and sent him into slavery.,"https://m.media-amazon.com/images/M/MV5BMDliMmNhNDEtODUyOS00MjNlLTgxODEtN2U3NzIxMGVkZTA1L2ltYWdlXkEyXkFqcGdeQXVyNjU0OTQ0OTY@._V1_UX67_CR0,0,67,98_AL_.jpg",2000,155 min,Gladiator,Russell Crowe,Joaquin Phoenix,Connie Nielsen,Oliver Reed,646bbde4cbb1b4e99b76a7d2
Tony Kaye,Drama,8.5,A former neo-nazi skinhead tries to prevent his younger brother from going down the same wrong path that he did.,"https://m.media-amazon.com/images/M/MV5BZjA0MTM4MTQtNzY5MC00NzY3LWI1ZTgtYzcxMjkyMzU4MDZiXkEyXkFqcGdeQXVyNDYyMDk5MTU@._V1_UX67_CR0,0,67,98_AL_.jpg",1998,119 min,American History X,Edward Norton,Edward Furlong,"Beverly D'Angelo",Jennifer Lien,646bbde4cbb1b4e99b76a7d3
Bryan Singer,"Crime, Mystery, Thriller",8.5,"A sole survivor tells of the twisty events leading up to a horrific gun battle on a boat, which began when five criminals met at a seemingly random police lineup.","https://m.media-amazon.com/images/M/MV5BYTViNjMyNmUtNDFkNC00ZDRlLThmMDUtZDU2YWE4NGI2ZjVmXkEyXkFqcGdeQXVyNjU0OTQ0OTY@._V1_UX67_CR0,0,67,98_AL_.jpg",1995,106 min,The Usual Suspects,Kevin Spacey,Gabriel Byrne,Chazz Palminteri,Stephen Baldwin,646bbde4cbb1b4e99b76a7d4
Luc Besson,"Action, Crime, Drama",8.5,"Mathilda, a 12-year-old girl, is reluctantly taken in by Léon, a professional assassin, after her family is murdered. An unusual relationship forms as she becomes his protégée and learns the assassin's trade.","https://m.media-amazon.com/images/M/MV5BODllNWE0MmEtYjUwZi00ZjY3LThmNmQtZjZlMjI2YTZjYmQ0XkEyXkFqcGdeQXVyNTc1NTQxODI@._V1_UX67_CR0,0,67,98_AL_.jpg",1994,110 min,Léon,Jean Reno,Gary Oldman,Natalie Portman,Danny Aiello,646bbde4cbb1b4e99b76a7d5
Roger Allers,"Animation, Adventure, Drama",8.5,"Lion prince Simba and his father are targeted by his bitter uncle, who wants to ascend the throne himself.","https://m.media-amazon.com/images/M/MV5BYTYxNGMyZTYtMjE3MS00MzNjLWFjNmYtMDk3N2FmM2JiM2M1XkEyXkFqcGdeQXVyNjY5NDU4NzI@._V1_UX67_CR0,0,67,98_AL_.jpg",1994,88 min,The Lion King,Rob Minkoff,Matthew Broderick,Jeremy Irons,James Earl Jones,646bbde4cbb1b4e99b76a7d6
James Cameron,"Action, Sci-Fi",8.5,"A cyborg, identical to the one who failed to kill Sarah Connor, must now protect her teenage son, John Connor, from a more advanced and powerful cyborg.","https://m.media-amazon.com/images/M/MV5BMGU2NzRmZjUtOGUxYS00ZjdjLWEwZWItY2NlM2JhNjkxNTFmXkEyXkFqcGdeQXVyNjU0OTQ0OTY@._V1_UX67_CR0,0,67,98_AL_.jpg",1991,137 min,Terminator 2: Judgment Day,Arnold Schwarzenegger,Linda Hamilton,Edward Furlong,Robert Patrick,646bbde4cbb1b4e99b76a7d7
Giuseppe Tornatore,"Drama, Romance",8.5,"A filmmaker recalls his childhood when falling in love with the pictures at the cinema of his home village and forms a deep friendship with the cinema's projectionist.","https://m.media-amazon.com/images/M/MV5BM2FhYjEyYmYtMDI1Yy00YTdlLWI2NWQtYmEzNzAxOGY1NjY2XkEyXkFqcGdeQXVyNTA3NTIyNDg@._V1_UX67_CR0,0,67,98_AL_.jpg",1988,155 min,Nuovo Cinema Paradiso,Philippe Noiret,Enzo Cannavale,Antonella Attili,Isa Danieli,646bbde4cbb1b4e99b76a7d8
Isao Takahata,"Animation, Drama, War",8.5,A young boy and his little sister struggle to survive in Japan during World War II.,"https://m.media-amazon.com/images/M/MV5BZmY2NjUzNDQtNTgxNC00M2Q4LTljOWQtMjNjNDBjNWUxNmJlXkEyXkFqcGdeQXVyNTA4NzY1MzY@._V1_UX67_CR0,0,67,98_AL_.jpg",1988,89 min,Hotaru no haka,Tsutomu Tatsumi,Ayano Shiraishi,Akemi Yamaguchi,Yoshiko Shinohara,646bbde4cbb1b4e99b76a7d9
Robert Zemeckis,"Adventure, Comedy, Sci-Fi",8.5,"Marty McFly, a 17-year-old high school student, is accidentally sent thirty years into the past in a time-traveling DeLorean invented by his close friend, the eccentric scientist Doc Brown.","https://m.media-amazon.com/images/M/MV5BZmU0M2Y1OGUtZjIxNi00ZjBkLTg1MjgtOWIyNThiZWIwYjRiXkEyXkFqcGdeQXVyMTQxNzMzNDI@._V1_UX67_CR0,0,67,98_AL_.jpg",1985,116 min,Back to the Future,Michael J. Fox,Christopher Lloyd,Lea Thompson,Crispin Glover,646bbde4cbb1b4e99b76a7da
Sergio Leone,Western,8.5,A mysterious stranger with a harmonica joins forces with a notorious desperado to protect a beautiful widow from a ruthless assassin working for the railroad.,"https://m.media-amazon.com/images/M/MV5BZGI5MjBmYzYtMzJhZi00NGI1LTk3MzItYjBjMzcxM2U3MDdiXkEyXkFqcGdeQXVyNzkwMjQ5NzM@._V1_UX67_CR0,0,67,98_AL_.jpg",1968,165 min,Once Upon a Time in the West,Henry Fonda,Charles Bronson,Claudia Cardinale,Jason Robards,646bbde4cbb1b4e99b76a7db
Alfred Hitchcock,"Horror, Mystery, Thriller",8.5,"A Phoenix secretary embezzles $40,000 from her employer's client, goes on the run, and checks into a remote motel run by a young man under the domination of his mother.","https://m.media-amazon.com/images/M/MV5BNTQwNDM1YzItNDAxZC00NWY2LTk0M2UtNDIwNWI5OGUyNWUxXkEyXkFqcGdeQXVyNzkwMjQ5NzM@._V1_UX67_CR0,0,67,98_AL_.jpg",1960,109 min,Psycho,Anthony Perkins,Janet Leigh,Vera Miles,John Gavin,646bbde4cbb1b4e99b76a7dc
Michael Curtiz,"Drama, Romance, War",8.5,A cynical expatriate American cafe owner struggles to decide whether or not to help his former lover and her fugitive husband escape the Nazis in French Morocco.,"https://m.media-amazon.com/images/M/MV5BY2IzZGY2YmEtYzljNS00NTM5LTgwMzUtMzM1NjQ4NGI0OTk0XkEyXkFqcGdeQXVyNDYyMDk5MTU@._V1_UX67_CR0,0,67,98_AL_.jpg",1942,102 min,Casablanca,Humphrey Bogart,Ingrid Bergman,Paul Henreid,Claude Rains,646bbde4cbb1b4e99b76a7dd
Charles Chaplin,"Comedy, Drama, Family",8.5,The Tramp struggles to live in modern industrial society with the help of a young homeless woman.,"https://m.media-amazon.com/images/M/MV5BYjJiZjMzYzktNjU0NS00OTkxLWEwYzItYzdhYWJjN2QzMTRlL2ltYWdlL2ltYWdlXkEyXkFqcGdeQXVyNjU0OTQ0OTY@._V1_UX67_CR0,0,67,98_AL_.jpg",1936,87 min,Modern Times,Charles Chaplin,Paulette Goddard,Henry Bergman,Tiny Sandford,646bbde4cbb1b4e99b76a7de
Charles Chaplin,"Comedy, Drama, Romance",8.5,"With the aid of a wealthy erratic tippler, a dewy-eyed tramp who has fallen in love with a sightless flower girl accumulates money to be able to help her medically.","https://m.media-amazon.com/images/M/MV5BY2I4MmM1N2EtM2YzOS00OWUzLTkzYzctNDc5NDg2N2IyODJmXkEyXkFqcGdeQXVyNzkwMjQ5NzM@._V1_UX67_CR0,0,67,98_AL_.jpg",1931,87 min,City Lights,Charles Chaplin,Virginia Cherrill,Florence Lee,Harry Myers,646bbde4cbb1b4e99b76a7df
Nadine Labaki,Drama,8.4,"While serving a five-year sentence for a violent crime, a 12-year-old boy sues his parents for neglect.","https://m.media-amazon.com/images/M/MV5BMmExNzU2ZWMtYzUwYi00YmM2LTkxZTQtNmVhNjY0NTMyMWI2XkEyXkFqcGdeQXVyMTMxODk2OTU@._V1_UX67_CR0,0,67,98_AL_.jpg",2018,126 min,Capharnaüm,Zain Al Rafeea,Yordanos Shiferaw,Boluwatife Treasure Bankole,Kawsar Al Haddad,646bbde4cbb1b4e99b76a7e0
Can Ulkay,"Biography, Drama, History",8.4,"In 1950, amid-st the ravages of the Korean War, Sergeant Süleyman stumbles upon a half-frozen little girl, with no parents and no help in sight. Frantic, scared and on the verge of death, ...                See full summary »","https://m.media-amazon.com/images/M/MV5BNWJhMDlmZGUtYzcxNS00NDRiLWIwNjktNDY1Mjg3ZjBkYzY0XkEyXkFqcGdeQXVyMTU4MjUwMjI@._V1_UY98_CR2,0,67,98_AL_.jpg",2017,125 min,Ayla: The Daughter of War,Erdem Can,Çetin Tekindor,Ismail Hacioglu,Kyung-jin Lee,646bbde4cbb1b4e99b76a7e1
Gayatri,"Action, Crime, Drama",8.4,"Vikram, a no-nonsense police officer, accompanied by Simon, his partner, is on the hunt to capture Vedha, a smuggler and a murderer. Vedha tries to change Vikram's life, which leads to a conflict.","https://m.media-amazon.com/images/M/MV5BY2FiMTFmMzMtZDI2ZC00NDQyLWExYTUtOWNmZWM1ZDg5YjVjXkEyXkFqcGdeQXVyODIwMDI1NjM@._V1_UX67_CR0,0,67,98_AL_.jpg",2017,147 min,Vikram Vedha,Pushkar,Madhavan,Vijay Sethupathi,Shraddha Srinath,646bbde4cbb1b4e99b76a7e2
Makoto Shinkai,"Animation, Drama, Fantasy",8.4,"Two strangers find themselves linked in a bizarre way. When a connection forms, will distance be the only thing to keep them apart?","https://m.media-amazon.com/images/M/MV5BODRmZDVmNzUtZDA4ZC00NjhkLWI2M2UtN2M0ZDIzNDcxYThjL2ltYWdlXkEyXkFqcGdeQXVyNTk0MzMzODA@._V1_UX67_CR0,0,67,98_AL_.jpg",2016,106 min,Kimi no na wa.,Ryûnosuke Kamiki,Mone Kamishiraishi,Ryô Narita,Aoi Yûki,646bbde4cbb1b4e99b76a7e3
Nitesh Tiwari,"Action, Biography, Drama",8.4,Former wrestler Mahavir Singh Phogat and his two wrestler daughters struggle towards glory at the Commonwealth Games in the face of societal oppression.,"https://m.media-amazon.com/images/M/MV5BMTQ4MzQzMzM2Nl5BMl5BanBnXkFtZTgwMTQ1NzU3MDI@._V1_UY98_CR1,0,67,98_AL_.jpg",2016,161 min,Dangal,Aamir Khan,Sakshi Tanwar,Fatima Sana Shaikh,Sanya Malhotra,646bbde4cbb1b4e99b76a7e4
Bob Persichetti,"Animation, Action, Adventure",8.4,"Teen Miles Morales becomes the Spider-Man of his universe, and must join with five spider-powered individuals from other dimensions to stop a threat for all realities.","https://m.media-amazon.com/images/M/MV5BMjMwNDkxMTgzOF5BMl5BanBnXkFtZTgwNTkwNTQ3NjM@._V1_UX67_CR0,0,67,98_AL_.jpg",2018,117 min,Spider-Man: Into the Spider-Verse,Peter Ramsey,Rodney Rothman,Shameik Moore,Jake Johnson,646bbde4cbb1b4e99b76a7e5
Anthony Russo,"Action, Adventure, Drama",8.4,"After the devastating events of Avengers: Infinity War (2018), the universe is in ruins. With the help of remaining allies, the Avengers assemble once more in order to reverse Thanos' actions and restore balance to the universe.","https://m.media-amazon.com/images/M/MV5BMTc5MDE2ODcwNV5BMl5BanBnXkFtZTgwMzI2NzQ2NzM@._V1_UX67_CR0,0,67,98_AL_.jpg",2019,181 min,Avengers: Endgame,Joe Russo,Robert Downey Jr.,Chris Evans,Mark Ruffalo,646bbde4cbb1b4e99b76a7e6
Anthony Russo,"Action, Adventure, Sci-Fi",8.4,The Avengers and their allies must be willing to sacrifice all in an attempt to defeat the powerful Thanos before his blitz of devastation and ruin puts an end to the universe.,"https://m.media-amazon.com/images/M/MV5BMjMxNjY2MDU1OV5BMl5BanBnXkFtZTgwNzY1MTUwNTM@._V1_UX67_CR0,0,67,98_AL_.jpg",2018,149 min,Avengers: Infinity War,Joe Russo,Robert Downey Jr.,Chris Hemsworth,Mark Ruffalo,646bbde4cbb1b4e99b76a7e7
Lee Unkrich,"Animation, Adventure, Family",8.4,"Aspiring musician Miguel, confronted with his family's ancestral ban on music, enters the Land of the Dead to find his great-great-grandfather, a legendary singer.","https://m.media-amazon.com/images/M/MV5BYjQ5NjM0Y2YtNjZkNC00ZDhkLWJjMWItN2QyNzFkMDE3ZjAxXkEyXkFqcGdeQXVyODIxMzk5NjA@._V1_UY98_CR1,0,67,98_AL_.jpg",2017,105 min,Coco,Adrian Molina,Anthony Gonzalez,Gael García Bernal,Benjamin Bratt,646bbde4cbb1b4e99b76a7e8
Quentin Tarantino,"Drama, Western",8.4,"With the help of a German bounty hunter, a freed slave sets out to rescue his wife from a brutal Mississippi plantation owner.","https://m.media-amazon.com/images/M/MV5BMjIyNTQ5NjQ1OV5BMl5BanBnXkFtZTcwODg1MDU4OA@@._V1_UX67_CR0,0,67,98_AL_.jpg",2012,165 min,Django Unchained,Jamie Foxx,Christoph Waltz,Leonardo DiCaprio,Kerry Washington,646bbde4cbb1b4e99b76a7e9
Christopher Nolan,"Action, Adventure",8.4,"Eight years after the Joker's reign of anarchy, Batman, with the help of the enigmatic Catwoman, is forced from his exile to save Gotham City from the brutal guerrilla terrorist Bane.","https://m.media-amazon.com/images/M/MV5BMTk4ODQzNDY3Ml5BMl5BanBnXkFtZTcwODA0NTM4Nw@@._V1_UX67_CR0,0,67,98_AL_.jpg",2012,164 min,The Dark Knight Rises,Christian Bale,Tom Hardy,Anne Hathaway,Gary Oldman,646bbde4cbb1b4e99b76a7ea
Rajkumar Hirani,"Comedy, Drama",8.4,"Two friends are searching for their long lost companion. They revisit their college days and recall the memories of their friend who inspired them to think differently, even as the rest of the world called them ""idiots"".","https://m.media-amazon.com/images/M/MV5BNTkyOGVjMGEtNmQzZi00NzFlLTlhOWQtODYyMDc2ZGJmYzFhXkEyXkFqcGdeQXVyNjU0OTQ0OTY@._V1_UY98_CR0,0,67,98_AL_.jpg",2009,170 min,3 Idiots,Aamir Khan,Madhavan,Mona Singh,Sharman Joshi,646bbde4cbb1b4e99b76a7eb
Aamir Khan,"Drama, Family",8.4,"An eight-year-old boy is thought to be a lazy trouble-maker, until the new art teacher has the patience and compassion to discover the real problem behind his struggles in school.","https://m.media-amazon.com/images/M/MV5BMDhjZWViN2MtNzgxOS00NmI4LThiZDQtZDI3MzM4MDE4NTc0XkEyXkFqcGdeQXVyMTMxODk2OTU@._V1_UY98_CR1,0,67,98_AL_.jpg",2007,165 min,Taare Zameen Par,Amole Gupte,Darsheel Safary,Aamir Khan,Tisca Chopra,646bbde4cbb1b4e99b76a7ec
Andrew Stanton,"Animation, Adventure, Family",8.4,"In the distant future, a small waste-collecting robot inadvertently embarks on a space journey that will ultimately decide the fate of mankind.","https://m.media-amazon.com/images/M/MV5BMjExMTg5OTU0NF5BMl5BanBnXkFtZTcwMjMxMzMzMw@@._V1_UX67_CR0,0,67,98_AL_.jpg",2008,98 min,WALL·E,Ben Burtt,Elissa Knight,Jeff Garlin,Fred Willard,646bbde4cbb1b4e99b76a7ed
Florian Henckel von Donnersmarck,"Drama, Mystery, Thriller",8.4,"In 1984 East Berlin, an agent of the secret police, conducting surveillance on a writer and his lover, finds himself becoming increasingly absorbed by their lives.","https://m.media-amazon.com/images/M/MV5BOThkM2EzYmMtNDE3NS00NjlhLTg4YzktYTdhNzgyOWY3ZDYzXkEyXkFqcGdeQXVyNzQzNzQxNzI@._V1_UY98_CR1,0,67,98_AL_.jpg",2006,137 min,The Lives of Others,Ulrich Mühe,Martina Gedeck,Sebastian Koch,Ulrich Tukur,646bbde4cbb1b4e99b76a7ee
Chan-wook Park,"Action, Drama, Mystery",8.4,"After being kidnapped and imprisoned for fifteen years, Oh Dae-Su is released, only to find that he must find his captor in five days.","https://m.media-amazon.com/images/M/MV5BMTI3NTQyMzU5M15BMl5BanBnXkFtZTcwMTM2MjgyMQ@@._V1_UX67_CR0,0,67,98_AL_.jpg",2003,101 min,Oldeuboi,Choi Min-sik,Yoo Ji-Tae,Kang Hye-jeong,Kim Byeong-Ok,646bbde4cbb1b4e99b76a7ef
Christopher Nolan,"Mystery, Thriller",8.4,"A man with short-term memory loss attempts to track down his wife's murderer.","https://m.media-amazon.com/images/M/MV5BZTcyNjk1MjgtOWI3Mi00YzQwLWI5MTktMzY4ZmI2NDAyNzYzXkEyXkFqcGdeQXVyNjU0OTQ0OTY@._V1_UX67_CR0,0,67,98_AL_.jpg",2000,113 min,Memento,Guy Pearce,Carrie-Anne Moss,Joe Pantoliano,Mark Boone Junior,646bbde4cbb1b4e99b76a7f0
Hayao Miyazaki,"Animation, Action, Adventure",8.4,"On a journey to find the cure for a Tatarigami's curse, Ashitaka finds himself in the middle of a war between the forest gods and Tatara, a mining colony. In this quest he also meets San, the Mononoke Hime.","https://m.media-amazon.com/images/M/MV5BNGIzY2IzODQtNThmMi00ZDE4LWI5YzAtNzNlZTM1ZjYyYjUyXkEyXkFqcGdeQXVyODEzNjM5OTQ@._V1_UX67_CR0,0,67,98_AL_.jpg",1997,134 min,Mononoke-hime,Yôji Matsuda,Yuriko Ishida,Yûko Tanaka,Billy Crudup,646bbde4cbb1b4e99b76a7f1
Sergio Leone,"Crime, Drama",8.4,"A former Prohibition-era Jewish gangster returns to the Lower East Side of Manhattan over thirty years later, where he once again must confront the ghosts and regrets of his old life.","https://m.media-amazon.com/images/M/MV5BMGFkNWI4MTMtNGQ0OC00MWVmLTk3MTktOGYxN2Y2YWVkZWE2XkEyXkFqcGdeQXVyNjU0OTQ0OTY@._V1_UX67_CR0,0,67,98_AL_.jpg",1984,229 min,Once Upon a Time in America,Robert De Niro,James Woods,Elizabeth McGovern,Treat Williams,646bbde4cbb1b4e99b76a7f2
