Director,Genre,IMDB_Rating,Overview,Poster_Link,Released_Year,Runtime,Series_Title,Star1,Star2,Star3,Star4,_id
Ashutosh Gowariker,"Adventure, Drama, Musical",8.1,The people of a small village in Victorian India stake their future on a game of cricket against their ruthless British rulers.,"https://m.media-amazon.com/images/M/MV5BNDYxNWUzZmYtOGQxMC00MTdkLTkxOTctYzkyOGIwNWQxZjhmXkEyXkFqcGdeQXVyNjU0OTQ0OTY@._V1_UX67_CR0,0,67,98_AL_.jpg",2001,224 min,Lagaan: Once Upon a Time in India,Aamir Khan,Raghuvir Yadav,Gracy Singh,Rachel Shelley,646bbde4cbb1b4e99b76a8a2
M. Night Shyamalan,"Drama, Mystery, Thriller",8.1,A boy who communicates with spirits seeks the help of a disheartened child psychologist.,"https://m.media-amazon.com/images/M/MV5BMWM4NTFhYjctNzUyNi00NGMwLTk3NTYtMDIyNTZmMzRlYmQyXkEyXkFqcGdeQXVyMTAwMzUyOTc@._V1_UX67_CR0,0,67,98_AL_.jpg",1999,107 min,The Sixth Sense,Bruce Willis,Haley Joel Osment,Toni Collette,Olivia Williams,646bbde4cbb1b4e99b76a8a3
Giuseppe Tornatore,"Drama, Music, Romance",8.1,"A baby boy, discovered in 1900 on an ocean liner, grows into a musical prodigy, never setting foot on land.","https://m.media-amazon.com/images/M/MV5BMzIwOTdmNjQtOWQ1ZS00ZWQ4LWIxYTMtOWFkM2NjODJiMGY4L2ltYWdlL2ltYWdlXkEyXkFqcGdeQXVyNTI4MjkwNjA@._V1_UX67_CR0,0,67,98_AL_.jpg",1998,169 min,"La leggenda del pianista sull'oceano",Tim Roth,Pruitt Taylor Vince,Mélanie Thierry,Bill Nunn,646bbde4cbb1b4e99b76a8a4
Peter Weir,"Comedy, Drama",8.1,An insurance salesman discovers his whole life is actually a reality TV show.,"https://m.media-amazon.com/images/M/MV5BMDIzODcyY2EtMmY2MC00ZWVlLTgwMzAtMjQwOWUyNmJjNTYyXkEyXkFqcGdeQXVyNDk3NzU2MTQ@._V1_UX67_CR0,0,67,98_AL_.jpg",1998,103 min,The Truman Show,Jim Carrey,Ed Harris,Laura Linney,Noah Emmerich,646bbde4cbb1b4e99b76a8a5
Emir Kusturica,"Comedy, Crime, Romance",8.1,Matko and his son Zare live on the banks of the Danube river and get by through hustling and basically doing anything to make a living. In order to pay off a business debt Matko agrees to marry off Zare to the sister of a local gangster.,"https://m.media-amazon.com/images/M/MV5BMmExZTZhN2QtMzg5Mi00Y2M5LTlmMWYtNTUzMzUwMGM2OGQ3XkEyXkFqcGdeQXVyNTA4NzY1MzY@._V1_UX67_CR0,0,67,98_AL_.jpg",1998,127 min,"Crna macka, beli macor",Bajram Severdzan,"Srdjan 'Zika' Todorovic",Branka Katic,Florijan Ajdini,646bbde4cbb1b4e99b76a8a6
Joel Coen,"Comedy, Crime, Sport",8.1,"Jeff ""The Dude"" Lebowski, mistaken for a millionaire of the same name, seeks restitution for his ruined rug and enlists his bowling buddies to help get it.","https://m.media-amazon.com/images/M/MV5BMTQ0NjUzMDMyOF5BMl5BanBnXkFtZTgwODA1OTU0MDE@._V1_UX67_CR0,0,67,98_AL_.jpg",1998,117 min,The Big Lebowski,Ethan Coen,Jeff Bridges,John Goodman,Julianne Moore,646bbde4cbb1b4e99b76a8a7
Kar-Wai Wong,"Drama, Romance",8.1,"Two neighbors, a woman and a man, form a strong bond after both suspect extramarital activities of their spouses. However, they agree to keep their bond platonic so as not to commit similar wrongs.","https://m.media-amazon.com/images/M/MV5BYjZjODRlMjQtMjJlYy00ZDBjLTkyYTQtZGQxZTk5NzJhYmNmXkEyXkFqcGdeQXVyMTQxNzMzNDI@._V1_UY98_CR1,0,67,98_AL_.jpg",2000,98 min,Fa yeung nin wah,Tony Chiu-Wai Leung,Maggie Cheung,Ping Lam Siu,"Tung Cho 'Joe' Cheung",646bbde4cbb1b4e99b76a8a8
Danny Boyle,Drama,8.1,"Renton, deeply immersed in the Edinburgh drug scene, tries to clean up and get out, despite the allure of the drugs and influence of friends.","https://m.media-amazon.com/images/M/MV5BMzA5Zjc3ZTMtMmU5YS00YTMwLWI4MWUtYTU0YTVmNjVmODZhXkEyXkFqcGdeQXVyNjU0OTQ0OTY@._V1_UX67_CR0,0,67,98_AL_.jpg",1996,93 min,Trainspotting,Ewan McGregor,Ewen Bremner,Jonny Lee Miller,Kevin McKidd,646bbde4cbb1b4e99b76a8a9
Joel Coen,"Crime, Drama, Thriller",8.1,"Jerry Lundegaard's inept crime falls apart due to his and his henchmen's bungling and the persistent police work of the quite pregnant Marge Gunderson.","https://m.media-amazon.com/images/M/MV5BNDJiZDgyZjctYmRjMS00ZjdkLTkwMTEtNGU1NDg3NDQ0Yzk1XkEyXkFqcGdeQXVyNzkwMjQ5NzM@._V1_UX67_CR0,0,67,98_AL_.jpg",1996,98 min,Fargo,Ethan Coen,William H. Macy,Frances McDormand,Steve Buscemi,646bbde4cbb1b4e99b76a8aa
Emir Kusturica,"Comedy, Drama, War",8.1,"A group of Serbian socialists prepares for the war in a surreal underground filled by parties, tragedies, love and hate.","https://m.media-amazon.com/images/M/MV5BNzI4YTVmMWEtMWQ3MS00OGE1LWE5YjMtNjc4NWJmYjRmZTQyXkEyXkFqcGdeQXVyNTA4NzY1MzY@._V1_UY98_CR0,0,67,98_AL_.jpg",1995,170 min,Underground,"Predrag 'Miki' Manojlovic",Lazar Ristovski,Mirjana Jokovic,Slavko Stimac,646bbde4cbb1b4e99b76a8ab
Mathieu Kassovitz,"Crime, Drama",8.1,24 hours in the lives of three young men in the French suburbs the day after a violent riot.,"https://m.media-amazon.com/images/M/MV5BNDNiOTA5YjktY2Q0Ni00ODgzLWE5MWItNGExOWRlYjY2MjBlXkEyXkFqcGdeQXVyNjQ2MjQ5NzM@._V1_UY98_CR1,0,67,98_AL_.jpg",1995,98 min,La haine,Vincent Cassel,Hubert Koundé,Saïd Taghmaoui,Abdel Ahmed Ghili,646bbde4cbb1b4e99b76a8ac
Aditya Chopra,"Drama, Romance",8.1,"When Raj meets Simran in Europe, it isn't love at first sight but when Simran moves to India for an arranged marriage, love makes its presence felt.","https://m.media-amazon.com/images/M/MV5BYmNjYzRlM2YtZTZjZC00ODVmLTljZWMtODg1YmYyNDBiNzU3XkEyXkFqcGdeQXVyNTkzNDQ4ODc@._V1_UY98_CR3,0,67,98_AL_.jpg",1995,189 min,Dilwale Dulhania Le Jayenge,Shah Rukh Khan,Kajol,Amrish Puri,Farida Jalal,646bbde4cbb1b4e99b76a8ad
Richard Linklater,"Drama, Romance",8.1,"A young man and woman meet on a train in Europe, and wind up spending one evening together in Vienna. Unfortunately, both know that this will probably be their only night together.","https://m.media-amazon.com/images/M/MV5BZDdiZTAwYzAtMDI3Ni00OTRjLTkzN2UtMGE3MDMyZmU4NTU4XkEyXkFqcGdeQXVyNjU0OTQ0OTY@._V1_UX67_CR0,0,67,98_AL_.jpg",1995,101 min,Before Sunrise,Ethan Hawke,Julie Delpy,Andrea Eckert,Hanno Pöschl,646bbde4cbb1b4e99b76a8ae
Krzysztof Kieslowski,"Drama, Mystery, Romance",8.1,"A model discovers a retired judge is keen on invading people's privacy.","https://m.media-amazon.com/images/M/MV5BYTg1MmNiMjItMmY4Yy00ZDQ3LThjMzYtZGQ0ZTQzNTdkMGQ1L2ltYWdlL2ltYWdlXkEyXkFqcGdeQXVyMTQxNzMzNDI@._V1_UX67_CR0,0,67,98_AL_.jpg",1994,99 min,Trois couleurs: Rouge,Irène Jacob,Jean-Louis Trintignant,Frédérique Feder,Jean-Pierre Lorit,646bbde4cbb1b4e99b76a8af
Kar-Wai Wong,"Comedy, Crime, Drama",8.1,"Two melancholy Hong Kong policemen fall in love: one with a mysterious female underworld figure, the other with a beautiful and ethereal server at a late-night restaurant he frequents.","https://m.media-amazon.com/images/M/MV5BMGQ5MzljNzYtMDM1My00NmI0LThlYzQtMTg0ZmQ0MTk1YjkxXkEyXkFqcGdeQXVyNTAyODkwOQ@@._V1_UY98_CR1,0,67,98_AL_.jpg",1994,102 min,Chung Hing sam lam,Brigitte Lin,Takeshi Kaneshiro,Tony Chiu-Wai Leung,Faye Wong,646bbde4cbb1b4e99b76a8b0
Steven Spielberg,"Action, Adventure, Sci-Fi",8.1,"A pragmatic paleontologist visiting an almost complete theme park is tasked with protecting a couple of kids after a power failure causes the park's cloned dinosaurs to run loose.","https://m.media-amazon.com/images/M/MV5BMjM2MDgxMDg0Nl5BMl5BanBnXkFtZTgwNTM2OTM5NDE@._V1_UX67_CR0,0,67,98_AL_.jpg",1993,127 min,Jurassic Park,Sam Neill,Laura Dern,Jeff Goldblum,Richard Attenborough,646bbde4cbb1b4e99b76a8b1
Jim Sheridan,"Biography, Crime, Drama",8.1,"A man's coerced confession to an I.R.A. bombing he did not commit results in the imprisonment of his father as well. An English lawyer fights to free them.","https://m.media-amazon.com/images/M/MV5BMmYyOTgwYWItYmU3Ny00M2E2LTk0NWMtMDVlNmQ0MWZiMTMxXkEyXkFqcGdeQXVyNzkwMjQ5NzM@._V1_UX67_CR0,0,67,98_AL_.jpg",1993,133 min,In the Name of the Father,Daniel Day-Lewis,Pete Postlethwaite,Alison Crosbie,Philip King,646bbde4cbb1b4e99b76a8b2
Kaige Chen,"Drama, Music, Romance",8.1,"Two boys meet at an opera training school in Peking in 1924. Their resulting friendship will span nearly 70 years and will endure some of the most troublesome times in China's history.","https://m.media-amazon.com/images/M/MV5BYmFhZmM3Y2MtNDA1Ny00NjkzLWJkM2EtYWU1ZjEwYmNjZDQ0XkEyXkFqcGdeQXVyMTMxMTY0OTQ@._V1_UX67_CR0,0,67,98_AL_.jpg",1993,171 min,Ba wang bie ji,Leslie Cheung,Fengyi Zhang,Gong Li,You Ge,646bbde4cbb1b4e99b76a8b3
Yimou Zhang,"Drama, History, Romance",8.1,"A young woman becomes the fourth wife of a wealthy lord, and must learn to live with the strict rules and tensions within the household.","https://m.media-amazon.com/images/M/MV5BMjEzNjY5NDcwNV5BMl5BanBnXkFtZTcwNzEwMzg4NA@@._V1_UX67_CR0,0,67,98_AL_.jpg",1991,125 min,Dà hóng denglong gaogao guà,Gong Li,Jingwu Ma,Saifei He,Cuifen Cao,646bbde4cbb1b4e99b76a8b4
Peter Weir,"Comedy, Drama",8.1,Maverick teacher John Keating uses poetry to embolden his boarding school students to new heights of self-expression.,"https://m.media-amazon.com/images/M/MV5BOGYwYWNjMzgtNGU4ZC00NWQ2LWEwZjUtMzE1Zjc3NjY3YTU1XkEyXkFqcGdeQXVyMTQxNzMzNDI@._V1_UX67_CR0,0,67,98_AL_.jpg",1989,128 min,Dead Poets Society,Robin Williams,Robert Sean Leonard,Ethan Hawke,Josh Charles,646bbde4cbb1b4e99b76a8b5
Rob Reiner,"Adventure, Drama",8.1,"After the death of one of his friends, a writer recounts a childhood journey with his friends to find the body of a missing boy.","https://m.media-amazon.com/images/M/MV5BODJmY2Y2OGQtMDg2My00N2Q3LWJmZTUtYTc2ODBjZDVlNDlhXkEyXkFqcGdeQXVyMTQxNzMzNDI@._V1_UX67_CR0,0,67,98_AL_.jpg",1986,89 min,Stand by Me,Wil Wheaton,River Phoenix,Corey Feldman,"Jerry O'Connell",646bbde4cbb1b4e99b76a8b6
Oliver Stone,"Drama, War",8.1,"Chris Taylor, a neophyte recruit in Vietnam, finds himself caught in a battle of wills between two sergeants, one good and the other evil. A shrewd examination of the brutality of war and the duality of man in conflict.","https://m.media-amazon.com/images/M/MV5BMzRjZjdlMjQtODVkYS00N2YzLWJlYWYtMGVlN2E5MWEwMWQzXkEyXkFqcGdeQXVyMTQxNzMzNDI@._V1_UX67_CR0,0,67,98_AL_.jpg",1986,120 min,Platoon,Charlie Sheen,Tom Berenger,Willem Dafoe,Keith David,646bbde4cbb1b4e99b76a8b7
Wim Wenders,Drama,8.1,"Travis Henderson, an aimless drifter who has been missing for four years, wanders out of the desert and must reconnect with society, himself, his life, and his family.","https://m.media-amazon.com/images/M/MV5BM2RjMmU3ZWItYzBlMy00ZmJkLWE5YzgtNTVkODdhOWM3NGZhXkEyXkFqcGdeQXVyNDA5Mjg5MjA@._V1_UX67_CR0,0,67,98_AL_.jpg",1984,145 min,"Paris, Texas",Harry Dean Stanton,Nastassja Kinski,Dean Stockwell,Aurore Clément,646bbde4cbb1b4e99b76a8b8
Hayao Miyazaki,"Animation, Adventure, Fantasy",8.1,Warrior and pacifist Princess Nausicaä desperately struggles to prevent two warring nations from destroying themselves and their dying planet.,"https://m.media-amazon.com/images/M/MV5BZWFkN2ZhODAtYTNkZS00Y2NjLWIzNDYtNzJjNDNlMzAyNTIyXkEyXkFqcGdeQXVyODEzNjM5OTQ@._V1_UY98_CR1,0,67,98_AL_.jpg",1984,117 min,Kaze no tani no Naushika,Sumi Shimamoto,Mahito Tsujimura,Hisako Kyôda,Gorô Naya,646bbde4cbb1b4e99b76a8b9
John Carpenter,"Horror, Mystery, Sci-Fi",8.1,A research team in Antarctica is hunted by a shape-shifting alien that assumes the appearance of its victims.,"https://m.media-amazon.com/images/M/MV5BNGViZWZmM2EtNGYzZi00ZDAyLTk3ODMtNzIyZTBjN2Y1NmM1XkEyXkFqcGdeQXVyNTAyODkwOQ@@._V1_UX67_CR0,0,67,98_AL_.jpg",1982,109 min,The Thing,Kurt Russell,Wilford Brimley,Keith David,Richard Masur,646bbde4cbb1b4e99b76a8ba
Alan Parker,"Drama, Fantasy, Music",8.1,A confined but troubled rock star descends into madness in the midst of his physical and social isolation from everyone.,"https://m.media-amazon.com/images/M/MV5BZDhlZTYxOTYtYTk3Ny00ZDljLTk3ZmItZTcxZWU5YTIyYmFkXkEyXkFqcGdeQXVyMTQxNzMzNDI@._V1_UX67_CR0,0,67,98_AL_.jpg",1982,95 min,Pink Floyd: The Wall,Bob Geldof,Christine Hargreaves,James Laurenson,Eleanor David,646bbde4cbb1b4e99b76a8bb
Werner Herzog,"Adventure, Drama",8.1,"The story of Brian Sweeney Fitzgerald, an extremely determined man who intends to build an opera house in the middle of a jungle.","https://m.media-amazon.com/images/M/MV5BYjIzNTYxMTctZjAwNS00YzI3LWExMGMtMGQxNGM5ZTc1NzhlXkEyXkFqcGdeQXVyMTQxNzMzNDI@._V1_UX67_CR0,0,67,98_AL_.jpg",1982,158 min,Fitzcarraldo,Klaus Kinski,Claudia Cardinale,José Lewgoy,Miguel Ángel Fuentes,646bbde4cbb1b4e99b76a8bc
Ingmar Bergman,Drama,8.1,"Two young Swedish children experience the many comedies and tragedies of their family, the Ekdahls.","https://m.media-amazon.com/images/M/MV5BZmQzMDE5ZWQtOTU3ZS00ZjdhLWI0OTctZDNkODk4YThmOTRhL2ltYWdlXkEyXkFqcGdeQXVyNjc1NTYyMjg@._V1_UX67_CR0,0,67,98_AL_.jpg",1982,188 min,Fanny och Alexander,Bertil Guve,Pernilla Allwin,Kristina Adolphson,Börje Ahlstedt,646bbde4cbb1b4e99b76a8bd
Ridley Scott,"Action, Sci-Fi, Thriller",8.1,"A blade runner must pursue and terminate four replicants who stole a ship in space, and have returned to Earth to find their creator.","https://m.media-amazon.com/images/M/MV5BNzQzMzJhZTEtOWM4NS00MTdhLTg0YjgtMjM4MDRkZjUwZDBlXkEyXkFqcGdeQXVyNjU0OTQ0OTY@._V1_UX67_CR0,0,67,98_AL_.jpg",1982,117 min,Blade Runner,Harrison Ford,Rutger Hauer,Sean Young,Edward James Olmos,646bbde4cbb1b4e99b76a8be
David Lynch,"Biography, Drama",8.1,"A Victorian surgeon rescues a heavily disfigured man who is mistreated while scraping a living as a side-show freak. Behind his monstrous façade, there is revealed a person of kindness, intelligence and sophistication.","https://m.media-amazon.com/images/M/MV5BMDVjNjIwOGItNDE3Ny00OThjLWE0NzQtZTU3YjMzZTZjMzhkXkEyXkFqcGdeQXVyMTQxNzMzNDI@._V1_UX67_CR0,0,67,98_AL_.jpg",1980,124 min,The Elephant Man,Anthony Hopkins,John Hurt,Anne Bancroft,John Gielgud,646bbde4cbb1b4e99b76a8bf
Terry Jones,Comedy,8.1,"Born on the original Christmas in the stable next door to Jesus Christ, Brian of Nazareth spends his life being mistaken for a messiah.","https://m.media-amazon.com/images/M/MV5BMzAwNjU1OTktYjY3Mi00NDY5LWFlZWUtZjhjNGE0OTkwZDkwXkEyXkFqcGdeQXVyMTQxNzMzNDI@._V1_UX67_CR0,0,67,98_AL_.jpg",1979,94 min,Life of Brian,Graham Chapman,John Cleese,Michael Palin,Terry Gilliam,646bbde4cbb1b4e99b76a8c0
Michael Cimino,"Drama, War",8.1,An in-depth examination of the ways in which the U.S. Vietnam War impacts and disrupts the lives of people in a small industrial town in Pennsylvania.,"https://m.media-amazon.com/images/M/MV5BNDhmNTA0ZDMtYjhkNS00NzEzLWIzYTItOGNkMTVmYjE2YmI3XkEyXkFqcGdeQXVyNzkwMjQ5NzM@._V1_UX67_CR0,0,67,98_AL_.jpg",1978,183 min,The Deer Hunter,Robert De Niro,Christopher Walken,John Cazale,John Savage,646bbde4cbb1b4e99b76a8c1
John G. Avildsen,"Drama, Sport",8.1,A small-time boxer gets a supremely rare chance to fight a heavy-weight champion in a bout in which he strives to go the distance for his self-respect.,"https://m.media-amazon.com/images/M/MV5BMTY5MDMzODUyOF5BMl5BanBnXkFtZTcwMTQ3NTMyNA@@._V1_UX67_CR0,0,67,98_AL_.jpg",1976,120 min,Rocky,Sylvester Stallone,Talia Shire,Burt Young,Carl Weathers,646bbde4cbb1b4e99b76a8c2
Sidney Lumet,Drama,8.1,"A television network cynically exploits a deranged former anchor's ravings and revelations about the news media for its own profit.","https://m.media-amazon.com/images/M/MV5BZGNjYjM2MzItZGQzZi00NmY3LTgxOGUtMTQ2MWQxNWQ2MmMwXkEyXkFqcGdeQXVyNzM0MTUwNTY@._V1_UX67_CR0,0,67,98_AL_.jpg",1976,121 min,Network,Faye Dunaway,William Holden,Peter Finch,Robert Duvall,646bbde4cbb1b4e99b76a8c3
Stanley Kubrick,"Adventure, Drama, History",8.1,"An Irish rogue wins the heart of a rich widow and assumes her dead husband's aristocratic position in 18th-century England.","https://m.media-amazon.com/images/M/MV5BNmY0MWY2NDctZDdmMi00MjA1LTk0ZTQtZDMyZTQ1NTNlYzVjXkEyXkFqcGdeQXVyMjUzOTY1NTc@._V1_UX67_CR0,0,67,98_AL_.jpg",1975,185 min,Barry Lyndon,"Ryan O'Neal",Marisa Berenson,Patrick Magee,Hardy Krüger,646bbde4cbb1b4e99b76a8c4
Andrei Tarkovsky,"Biography, Drama",8.1,"A dying man in his forties remembers his past. His childhood, his mother, the war, personal moments and things that tell of the recent history of all the Russian nation.","https://m.media-amazon.com/images/M/MV5BMTg1MDg3OTk3M15BMl5BanBnXkFtZTgwMDEzMzE5MTE@._V1_UY98_CR0,0,67,98_AL_.jpg",1975,107 min,Zerkalo,Margarita Terekhova,Filipp Yankovskiy,Ignat Daniltsev,Oleg Yankovskiy,646bbde4cbb1b4e99b76a8c5
Roman Polanski,"Drama, Mystery, Thriller",8.1,"A private detective hired to expose an adulterer finds himself caught up in a web of deceit, corruption, and murder.","https://m.media-amazon.com/images/M/MV5BOGMwYmY5ZmEtMzY1Yi00OWJiLTk1Y2MtMzI2MjBhYmZkNTQ0XkEyXkFqcGdeQXVyNzkwMjQ5NzM@._V1_UX67_CR0,0,67,98_AL_.jpg",1974,130 min,Chinatown,Jack Nicholson,Faye Dunaway,John Huston,Perry Lopez,646bbde4cbb1b4e99b76a8c6
Peter Bogdanovich,"Comedy, Crime, Drama",8.1,"During the Great Depression, a con man finds himself saddled with a young girl who may or may not be his daughter, and the two forge an unlikely partnership.","https://m.media-amazon.com/images/M/MV5BOWVmYzQwY2MtOTBjNi00MDNhLWI5OGMtN2RiMDYxODI3MjU5XkEyXkFqcGdeQXVyMjUzOTY1NTc@._V1_UX67_CR0,0,67,98_AL_.jpg",1973,102 min,Paper Moon,"Ryan O'Neal","Tatum O'Neal",Madeline Kahn,John Hillerman,646bbde4cbb1b4e99b76a8c7
Ingmar Bergman,Drama,8.1,"When a woman dying of cancer in early twentieth-century Sweden is visited by her two sisters, long-repressed feelings between the siblings rise to the surface.","https://m.media-amazon.com/images/M/MV5BMTg3NzYzOTEtNmE2Ni00M2EyLWJhMjctNjMyMTk4ZTViOGUzXkEyXkFqcGdeQXVyNzQxNDExNTU@._V1_UY98_CR0,0,67,98_AL_.jpg",1972,91 min,Viskningar och rop,Harriet Andersson,Liv Ullmann,Kari Sylwan,Ingrid Thulin,646bbde4cbb1b4e99b76a8c8
Andrei Tarkovsky,"Drama, Mystery, Sci-Fi",8.1,A psychologist is sent to a station orbiting a distant planet in order to discover what has caused the crew to go insane.,"https://m.media-amazon.com/images/M/MV5BZmY4Yjc0OWQtZDRhMy00ODc2LWI2NGYtMWFlODYyN2VlNDQyXkEyXkFqcGdeQXVyNjU0OTQ0OTY@._V1_UY98_CR1,0,67,98_AL_.jpg",1972,167 min,Solaris,Natalya Bondarchuk,Donatas Banionis,Jüri Järvet,Vladislav Dvorzhetskiy,646bbde4cbb1b4e99b76a8c9
Jean-Pierre Melville,"Crime, Drama, Mystery",8.1,After professional hitman Jef Costello is seen by witnesses his efforts to provide himself an alibi drive him further into a corner.,"https://m.media-amazon.com/images/M/MV5BMWFjZjRiM2QtZmRkOC00MDUxLTlhYmQtYmY5ZTNiMTI5Nzc2L2ltYWdlXkEyXkFqcGdeQXVyNTAyODkwOQ@@._V1_UX67_CR0,0,67,98_AL_.jpg",1967,105 min,Le samouraï,Alain Delon,François Périer,Nathalie Delon,Cathy Rosier,646bbde4cbb1b4e99b76a8ca
Stuart Rosenberg,"Crime, Drama",8.1,"A laid back Southern man is sentenced to two years in a rural prison, but refuses to conform.","https://m.media-amazon.com/images/M/MV5BOWFlNzZhYmYtYTI5YS00MDQyLWIyNTUtNTRjMWUwNTEzNjA0XkEyXkFqcGdeQXVyNjUwNzk3NDc@._V1_UX67_CR0,0,67,98_AL_.jpg",1967,127 min,Cool Hand Luke,Paul Newman,George Kennedy,Strother Martin,J.D. Cannon,646bbde4cbb1b4e99b76a8cb
Ingmar Bergman,"Drama, Thriller",8.1,A nurse is put in charge of a mute actress and finds that their personae are melding together.,"https://m.media-amazon.com/images/M/MV5BMTM0YzExY2EtMjUyZi00ZmIwLWFkYTktNjY5NmVkYTdkMjI5XkEyXkFqcGdeQXVyNzQxNDExNTU@._V1_UY98_CR0,0,67,98_AL_.jpg",1966,85 min,Persona,Bibi Andersson,Liv Ullmann,Margaretha Krook,Gunnar Björnstrand,646bbde4cbb1b4e99b76a8cc
Andrei Tarkovsky,"Biography, Drama, History",8.1,"The life, times and afflictions of the fifteenth-century Russian iconographer St. Andrei Rublev.","https://m.media-amazon.com/images/M/MV5BNjM2MjMwNzUzN15BMl5BanBnXkFtZTgwMjEzMzE5MTE@._V1_UY98_CR2,0,67,98_AL_.jpg",1966,205 min,Andrei Rublev,Anatoliy Solonitsyn,Ivan Lapikov,Nikolay Grinko,Nikolay Sergeev,646bbde4cbb1b4e99b76a8cd
Gillo Pontecorvo,"Drama, War",8.1,"In the 1950s, fear and violence escalate as the people of Algiers fight for independence from the French government.","https://m.media-amazon.com/images/M/MV5BZWEzMGY4OTQtYTdmMy00M2QwLTliYTQtYWUzYzc3OTA5YzIwXkEyXkFqcGdeQXVyNjc1NTYyMjg@._V1_UY98_CR1,0,67,98_AL_.jpg",1966,121 min,La battaglia di Algeri,Brahim Hadjadj,Jean Martin,Yacef Saadi,Samia Kerbash,646bbde4cbb1b4e99b76a8ce
Luis Buñuel,"Drama, Fantasy",8.1,The guests at an upper-class dinner party find themselves unable to leave.,"https://m.media-amazon.com/images/M/MV5BZTg3M2ExY2EtZmI5Yy00YWM1LTg4NzItZWEzZTgxNzE2MjhhXkEyXkFqcGdeQXVyNDE5MTU2MDE@._V1_UX67_CR0,0,67,98_AL_.jpg",1962,95 min,El ángel exterminador,Silvia Pinal,Jacqueline Andere,Enrique Rambal,José Baviera,646bbde4cbb1b4e99b76a8cf
Robert Aldrich,"Drama, Horror, Thriller",8.1,A former child star torments her paraplegic sister in their decaying Hollywood mansion.,"https://m.media-amazon.com/images/M/MV5BZmI0M2VmNTgtMWVhYS00Zjg1LTk1YTYtNmJmMjRkZmMwYTc2XkEyXkFqcGdeQXVyNTA4NzY1MzY@._V1_UX67_CR0,0,67,98_AL_.jpg",1962,134 min,What Ever Happened to Baby Jane?,Bette Davis,Joan Crawford,Victor Buono,Wesley Addy,646bbde4cbb1b4e99b76a8d0
Akira Kurosawa,"Action, Comedy, Crime",8.1,"A crafty samurai helps a young man and his fellow clansmen save his uncle, who has been framed and imprisoned by a corrupt superintendent.","https://m.media-amazon.com/images/M/MV5BZmY3MDlmODctYTY3Yi00NzYyLWIxNTUtYjVlZWZjMmMwZTBkXkEyXkFqcGdeQXVyMzAxNjg3MjQ@._V1_UX67_CR0,0,67,98_AL_.jpg",1962,96 min,Sanjuro,Toshirô Mifune,Tatsuya Nakadai,Keiju Kobayashi,Yûnosuke Itô,646bbde4cbb1b4e99b76a8d1
John Ford,"Drama, Western",8.1,A senator returns to a western town for the funeral of an old friend and tells the story of his origins.,"https://m.media-amazon.com/images/M/MV5BMGEyNzhkYzktMGMyZS00YzRiLWJlYjktZjJkOTU5ZDY0ZGI4XkEyXkFqcGdeQXVyNjUwNzk3NDc@._V1_UX67_CR0,0,67,98_AL_.jpg",1962,123 min,The Man Who Shot Liberty Valance,James Stewart,John Wayne,Vera Miles,Lee Marvin,646bbde4cbb1b4e99b76a8d2
Andrei Tarkovsky,"Drama, War",8.1,"In WW2, twelve year old Soviet orphan Ivan Bondarev works for the Soviet army as a scout behind the German lines and strikes a friendship with three sympathetic Soviet officers.","https://m.media-amazon.com/images/M/MV5BYTYzYzBhYjQtNDQxYS00MmUwLTkyZjgtZWVkOWFjNzE5OTI2XkEyXkFqcGdeQXVyNjMxMjkwMjI@._V1_UX67_CR0,0,67,98_AL_.jpg",1962,95 min,Ivanovo detstvo,Eduard Abalov,Nikolay Burlyaev,Valentin Zubkov,Evgeniy Zharikov,646bbde4cbb1b4e99b76a8d3
Ingmar Bergman,Drama,8.1,"An innocent yet pampered young virgin and her family's pregnant and jealous servant set out to deliver candles to church, but only one returns from events that transpire in the woods along the way.","https://m.media-amazon.com/images/M/MV5BZjgyMzZkMGUtNTBhZC00OTkzLWI4ZmMtYzcwMzc5MjQ0YTM3XkEyXkFqcGdeQXVyMTMxMTY0OTQ@._V1_UY98_CR3,0,67,98_AL_.jpg",1960,89 min,Jungfrukällan,Max von Sydow,Birgitta Valberg,Gunnel Lindblom,Birgitta Pettersson,646bbde4cbb1b4e99b76a8d4
Stanley Kramer,"Biography, Drama, History",8.1,"Based on a real-life case in 1925, two great lawyers argue the case for and against a science teacher accused of the crime of teaching evolution.","https://m.media-amazon.com/images/M/MV5BMGQ5ODNkNWYtYTgxZS00YjJkLThhODAtYzUwNGNiYjRmNjdkXkEyXkFqcGdeQXVyMTg2NTc4MzA@._V1_UY98_CR4,0,67,98_AL_.jpg",1960,128 min,Inherit the Wind,Spencer Tracy,Fredric March,Gene Kelly,Dick York,646bbde4cbb1b4e99b76a8d5
François Truffaut,"Crime, Drama",8.1,"A young boy, left without attention, delves into a life of petty crime.","https://m.media-amazon.com/images/M/MV5BYTQ4MjA4NmYtYjRhNi00MTEwLTg0NjgtNjk3ODJlZGU4NjRkL2ltYWdlL2ltYWdlXkEyXkFqcGdeQXVyNjU0OTQ0OTY@._V1_UY98_CR3,0,67,98_AL_.jpg",1959,99 min,Les quatre cents coups,Jean-Pierre Léaud,Albert Rémy,Claire Maurier,Guy Decomble,646bbde4cbb1b4e99b76a8d6
William Wyler,"Adventure, Drama, History",8.1,"After a Jewish prince is betrayed and sent into slavery by a Roman friend, he regains his freedom and comes back for revenge.","https://m.media-amazon.com/images/M/MV5BNjgxY2JiZDYtZmMwOC00ZmJjLWJmODUtMTNmNWNmYWI5ODkwL2ltYWdlL2ltYWdlXkEyXkFqcGdeQXVyNjc1NTYyMjg@._V1_UX67_CR0,0,67,98_AL_.jpg",1959,212 min,Ben-Hur,Charlton Heston,Jack Hawkins,Stephen Boyd,Haya Harareet,646bbde4cbb1b4e99b76a8d7
Akira Kurosawa,"Adventure, Drama",8.1,"Lured by gold, two greedy peasants unknowingly escort a princess and her general across enemy lines.","https://m.media-amazon.com/images/M/MV5BYjJkN2Y5MTktZDRhOS00NTUwLWFiMzEtMTVlNWU4ODM0Y2E5XkEyXkFqcGdeQXVyNjc1NTYyMjg@._V1_UY98_CR1,0,67,98_AL_.jpg",1958,139 min,Kakushi-toride no san-akunin,Toshirô Mifune,Misa Uehara,Minoru Chiaki,Kamatari Fujiwara,646bbde4cbb1b4e99b76a8d8
Federico Fellini,Drama,8.1,A waifish prostitute wanders the streets of Rome looking for true love but finds only heartbreak.,"https://m.media-amazon.com/images/M/MV5BOTdhNmUxZmQtNmMwNC00MzE3LWE1MTUtZDgxZTYwYjEzZjcwXkEyXkFqcGdeQXVyNTA1NjYyMDk@._V1_UY98_CR0,0,67,98_AL_.jpg",1957,110 min,Le notti di Cabiria,Giulietta Masina,François Périer,Franca Marzi,Dorian Gray,646bbde4cbb1b4e99b76a8d9
Akira Kurosawa,"Drama, History",8.1,"A war-hardened general, egged on by his ambitious wife, works to fulfill a prophecy that he would become lord of Spider's Web Castle.","https://m.media-amazon.com/images/M/MV5BNGYxZjA2M2ItYTRmNS00NzRmLWJkYzgtYTdiNGFlZDI5ZjNmXkEyXkFqcGdeQXVyNDE5MTU2MDE@._V1_UY98_CR0,0,67,98_AL_.jpg",1957,110 min,Kumonosu-jô,Toshirô Mifune,Minoru Chiaki,Isuzu Yamada,Takashi Shimura,646bbde4cbb1b4e99b76a8da
David Lean,"Adventure, Drama, War",8.1,"British POWs are forced to build a railway bridge across the river Kwai for their Japanese captors, not knowing that the allied forces are planning to destroy it.","https://m.media-amazon.com/images/M/MV5BMGVhNjhjODktODgxYS00MDdhLTlkZjktYTkyNzQxMTU0ZDYxXkEyXkFqcGdeQXVyNzkwMjQ5NzM@._V1_UX67_CR0,0,67,98_AL_.jpg",1957,161 min,The Bridge on the River Kwai,William Holden,Alec Guinness,Jack Hawkins,Sessue Hayakawa,646bbde4cbb1b4e99b76a8db
Elia Kazan,"Crime, Drama, Thriller",8.1,An ex-prize fighter turned longshoreman struggles to stand up to his corrupt union bosses.,"https://m.media-amazon.com/images/M/MV5BY2I0MWFiZDMtNWQyYy00Njk5LTk3MDktZjZjNTNmZmVkYjkxXkEyXkFqcGdeQXVyNjc1NTYyMjg@._V1_UX67_CR0,0,67,98_AL_.jpg",1954,108 min,On the Waterfront,Marlon Brando,Karl Malden,Lee J. Cobb,Rod Steiger,646bbde4cbb1b4e99b76a8dc
