Director,Genre,IMDB_Rating,Overview,Poster_Link,Released_Year,Runtime,Series_Title,Star1,Star2,Star3,Star4,_id
Howard Hawks,"Comedy, Family, Romance",7.8,"While trying to secure a $1 million donation for his museum, a befuddled paleontologist is pursued by a flighty and often irritating heiress and her pet leopard, Baby.","https://m.media-amazon.com/images/M/MV5BMmVkOTRiYmItZjE4NS00MWNjLWE0ZmMtYzg5YzFjMjMyY2RkXkEyXkFqcGdeQXVyNjc1NTYyMjg@._V1_UX67_CR0,0,67,98_AL_.jpg",1938,102 min,Bringing Up Baby,Katharine Hepburn,Cary Grant,Charles Ruggles,Walter Catlett,646bbde4cbb1b4e99b76aa76
James Whale,"Drama, Horror, Sci-Fi",7.8,"Mary Shelley reveals the main characters of her novel survived: Dr. Frankenstein, goaded by an even madder scientist, builds his monster a mate.","https://m.media-amazon.com/images/M/MV5BOTUzMzAzMzEzNV5BMl5BanBnXkFtZTgwOTg1NTAwMjE@._V1_UX67_CR0,0,67,98_AL_.jpg",1935,75 min,Bride of Frankenstein,Boris Karloff,Elsa Lanchester,Colin Clive,Valerie Hobson,646bbde4cbb1b4e99b76aa77
Leo McCarey,"Comedy, Musical, War",7.8,Rufus T. Firefly is named president/dictator of bankrupt Freedonia and declares war on neighboring Sylvania over the love of wealthy Mrs. Teasdale.,"https://m.media-amazon.com/images/M/MV5BYmYxZGU2NWYtNzQxZS00NmEyLWIzN2YtMDk5MWM0ODc5ZTE4XkEyXkFqcGdeQXVyNTA4NzY1MzY@._V1_UX67_CR0,0,67,98_AL_.jpg",1933,69 min,Duck Soup,Groucho Marx,Harpo Marx,Chico Marx,Zeppo Marx,646bbde4cbb1b4e99b76aa78
Howard Hawks,"Action, Crime, Drama",7.8,"An ambitious and nearly insane violent gangster climbs the ladder of success in the mob, but his weaknesses prove to be his downfall.","https://m.media-amazon.com/images/M/MV5BYmMxZTU2ZDUtM2Y1MS00ZWFmLWJlN2UtNzI0OTJiOTYzMTk3XkEyXkFqcGdeQXVyMjUxODE0MDY@._V1_UX67_CR0,0,67,98_AL_.jpg",1932,93 min,Scarface: The Shame of the Nation,Richard Rosson,Paul Muni,Ann Dvorak,Karen Morley,646bbde4cbb1b4e99b76aa79
James Whale,"Drama, Horror, Sci-Fi",7.8,Dr. Frankenstein dares to tamper with life and death by creating a human monster out of lifeless body parts.,"https://m.media-amazon.com/images/M/MV5BMTQ0Njc1MjM0OF5BMl5BanBnXkFtZTgwNTY2NTUyMjE@._V1_UX67_CR0,0,67,98_AL_.jpg",1931,70 min,Frankenstein,Colin Clive,Mae Clarke,Boris Karloff,John Boles,646bbde4cbb1b4e99b76aa7a
Alfonso Cuarón,Drama,7.7,"A year in the life of a middle-class family's maid in Mexico City in the early 1970s.","https://m.media-amazon.com/images/M/MV5BMTU0OTc3ODk4Ml5BMl5BanBnXkFtZTgwMzM4NzI5NjM@._V1_UX67_CR0,0,67,98_AL_.jpg",2018,135 min,Roma,Yalitza Aparicio,Marina de Tavira,Diego Cortina Autrey,Carlos Peralta,646bbde4cbb1b4e99b76aa7b
Francis Lee,"Drama, Romance",7.7,"Spring. Yorkshire. Young farmer Johnny Saxby numbs his daily frustrations with binge drinking and casual sex, until the arrival of a Romanian migrant worker for lambing season ignites an intense relationship that sets Johnny on a new path.","https://m.media-amazon.com/images/M/MV5BNjRhYzk2NDAtYzA1Mi00MmNmLWE1ZjQtMDBhZmUyMTdjZjBiXkEyXkFqcGdeQXVyNjk1Njg5NTA@._V1_UX67_CR0,0,67,98_AL_.jpg",2017,104 min,"God's Own Country","Josh O'Connor",Alec Secareanu,Gemma Jones,Ian Hart,646bbde4cbb1b4e99b76aa7c
David Leitch,"Action, Adventure, Comedy",7.7,"Foul-mouthed mutant mercenary Wade Wilson (a.k.a. Deadpool), brings together a team of fellow mutant rogues to protect a young boy with supernatural abilities from the brutal, time-traveling cyborg Cable.","https://m.media-amazon.com/images/M/MV5BNjk1Njk3YjctMmMyYS00Y2I4LThhMzktN2U0MTMyZTFlYWQ5XkEyXkFqcGdeQXVyODM2ODEzMDA@._V1_UY98_CR15,0,67,98_AL_.jpg",2018,119 min,Deadpool 2,Ryan Reynolds,Josh Brolin,Morena Baccarin,Julian Dennison,646bbde4cbb1b4e99b76aa7d
Taylor Sheridan,"Crime, Drama, Mystery",7.7,A veteran hunter helps an FBI agent investigate the murder of a young woman on a Wyoming Native American reservation.,"https://m.media-amazon.com/images/M/MV5BMTUyMjU1OTUwM15BMl5BanBnXkFtZTgwMDg1NDQ2MjI@._V1_UX67_CR0,0,67,98_AL_.jpg",2017,107 min,Wind River,Kelsey Asbille,Jeremy Renner,Julia Jones,Teo Briones,646bbde4cbb1b4e99b76aa7e
Jordan Peele,"Horror, Mystery, Thriller",7.7,"A young African-American visits his white girlfriend's parents for the weekend, where his simmering uneasiness about their reception of him eventually reaches a boiling point.","https://m.media-amazon.com/images/M/MV5BMjUxMDQwNjcyNl5BMl5BanBnXkFtZTgwNzcwMzc0MTI@._V1_UX67_CR0,0,67,98_AL_.jpg",2017,104 min,Get Out,Daniel Kaluuya,Allison Williams,Bradley Whitford,Catherine Keener,646bbde4cbb1b4e99b76aa7f
Christopher McQuarrie,"Action, Adventure, Thriller",7.7,"Ethan Hunt and his IMF team, along with some familiar allies, race against time after a mission gone wrong.","https://m.media-amazon.com/images/M/MV5BNjRlZmM0ODktY2RjNS00ZDdjLWJhZGYtNDljNWZkMGM5MTg0XkEyXkFqcGdeQXVyNjAwMjI5MDk@._V1_UX67_CR0,0,67,98_AL_.jpg",2018,147 min,Mission: Impossible - Fallout,Tom Cruise,Henry Cavill,Ving Rhames,Simon Pegg,646bbde4cbb1b4e99b76aa80
Hannes Holm,"Comedy, Drama, Romance",7.7,"Ove, an ill-tempered, isolated retiree who spends his days enforcing block association rules and visiting his wife's grave, has finally given up on life just as an unlikely friendship develops with his boisterous new neighbors.","https://m.media-amazon.com/images/M/MV5BMjE0NDUyOTc2MV5BMl5BanBnXkFtZTgwODk2NzU3OTE@._V1_UX67_CR0,0,67,98_AL_.jpg",2015,116 min,En man som heter Ove,Rolf Lassgård,Bahar Pars,Filip Berg,Ida Engvoll,646bbde4cbb1b4e99b76aa81
Jemaine Clement,"Comedy, Horror",7.7,"Viago, Deacon and Vladislav are vampires who are finding that modern life has them struggling with the mundane - like paying rent, keeping up with the chore wheel, trying to get into nightclubs and overcoming flatmate conflicts.","https://m.media-amazon.com/images/M/MV5BMjAwNDA5NzEwM15BMl5BanBnXkFtZTgwMTA1MDUyNDE@._V1_UX67_CR0,0,67,98_AL_.jpg",2014,86 min,What We Do in the Shadows,Taika Waititi,Jemaine Clement,Taika Waititi,Cori Gonzalez-Macuer,646bbde4cbb1b4e99b76aa82
James Simone,"Animation, Drama, Family",7.7,"Due to 12 y.o. Anna's asthma, she's sent to stay with relatives of her guardian in the Japanese countryside. She likes to be alone, sketching. She befriends Marnie. Who is the mysterious, blonde Marnie.","https://m.media-amazon.com/images/M/MV5BZTlmYTJmMWEtNDRhNy00ODc1LTg2OTMtMjk2ODJhNTA4YTE1XkEyXkFqcGdeQXVyMTMxODk2OTU@._V1_UY98_CR0,0,67,98_AL_.jpg",2014,103 min,Omoide no Mânî,Hiromasa Yonebayashi,Sara Takatsuki,Kasumi Arimura,Nanako Matsushima,646bbde4cbb1b4e99b76aa83
James Marsh,"Biography, Drama, Romance",7.7,A look at the relationship between the famous physicist Stephen Hawking and his wife.,"https://m.media-amazon.com/images/M/MV5BMTAwMTU4MDA3NDNeQTJeQWpwZ15BbWU4MDk4NTMxNTIx._V1_UX67_CR0,0,67,98_AL_.jpg",2014,123 min,The Theory of Everything,Eddie Redmayne,Felicity Jones,Tom Prior,Sophie Perry,646bbde4cbb1b4e99b76aa84
Matthew Vaughn,"Action, Adventure, Comedy",7.7,"A spy organisation recruits a promising street kid into the agency's training program, while a global threat emerges from a twisted tech genius.","https://m.media-amazon.com/images/M/MV5BYTM3ZTllNzItNTNmOS00NzJiLTg1MWMtMjMxNDc0NmJhODU5XkEyXkFqcGdeQXVyODE5NzE3OTE@._V1_UX67_CR0,0,67,98_AL_.jpg",2014,129 min,Kingsman: The Secret Service,Colin Firth,Taron Egerton,Samuel L. Jackson,Michael Caine,646bbde4cbb1b4e99b76aa85
Josh Boone,"Drama, Romance",7.7,Two teenage cancer patients begin a life-affirming journey to visit a reclusive author in Amsterdam.,"https://m.media-amazon.com/images/M/MV5BNTVkMTFiZWItOTFkOC00YTc3LWFhYzQtZTg3NzAxZjJlNTAyXkEyXkFqcGdeQXVyODE5NzE3OTE@._V1_UX67_CR0,0,67,98_AL_.jpg",2014,126 min,The Fault in Our Stars,Shailene Woodley,Ansel Elgort,Nat Wolff,Laura Dern,646bbde4cbb1b4e99b76aa86
Alfonso Gomez-Rejon,"Comedy, Drama",7.7,"High schooler Greg, who spends most of his time making parodies of classic movies with his co-worker Earl, finds his outlook forever altered after befriending a classmate who has just been diagnosed with cancer.","https://m.media-amazon.com/images/M/MV5BNTA1NzUzNjY4MV5BMl5BanBnXkFtZTgwNDU0MDI0NTE@._V1_UX67_CR0,0,67,98_AL_.jpg",2015,105 min,Me and Earl and the Dying Girl,Thomas Mann,RJ Cyler,Olivia Cooke,Nick Offerman,646bbde4cbb1b4e99b76aa87
Alejandro G. Iñárritu,"Comedy, Drama",7.7,"A washed-up superhero actor attempts to revive his fading career by writing, directing, and starring in a Broadway production.","https://m.media-amazon.com/images/M/MV5BODAzNDMxMzAxOV5BMl5BanBnXkFtZTgwMDMxMjA4MjE@._V1_UX67_CR0,0,67,98_AL_.jpg",2014,119 min,Birdman or (The Unexpected Virtue of Ignorance),Michael Keaton,Zach Galifianakis,Edward Norton,Andrea Riseborough,646bbde4cbb1b4e99b76aa88
Abdellatif Kechiche,"Drama, Romance",7.7,"Adèle's life is changed when she meets Emma, a young woman with blue hair, who will allow her to discover desire and to assert herself as a woman and as an adult. In front of others, Adèle grows, seeks herself, loses herself, and ultimately finds herself through love and loss.","https://m.media-amazon.com/images/M/MV5BMTQ5NTg5ODk4OV5BMl5BanBnXkFtZTgwODc4MTMzMDE@._V1_UX67_CR0,0,67,98_AL_.jpg",2013,180 min,"La vie d'Adèle",Léa Seydoux,Adèle Exarchopoulos,Salim Kechiouche,Aurélien Recoing,646bbde4cbb1b4e99b76aa89
Abhishek Kapoor,"Drama, Sport",7.7,"Three friends growing up in India at the turn of the millennium set out to open a training academy to produce the country's next cricket stars.","https://m.media-amazon.com/images/M/MV5BMTgwNTAwMjEzMF5BMl5BanBnXkFtZTcwNzMzODY4OA@@._V1_UY98_CR3,0,67,98_AL_.jpg",2013,130 min,Kai po che!,Amit Sadh,Sushant Singh Rajput,Rajkummar Rao,Amrita Puri,646bbde4cbb1b4e99b76aa8a
Felix van Groeningen,"Drama, Music, Romance",7.7,"Elise and Didier fall in love at first sight, in spite of their differences. He talks, she listens. He's a romantic atheist, she's a religious realist. When their daughter becomes seriously ill, their love is put on trial.","https://m.media-amazon.com/images/M/MV5BMTQzMzg2Nzg2MF5BMl5BanBnXkFtZTgwNjUzNzIzMDE@._V1_UX67_CR0,0,67,98_AL_.jpg",2012,111 min,The Broken Circle Breakdown,Veerle Baetens,Johan Heldenbergh,Nell Cattrysse,Geert Van Rampelberg,646bbde4cbb1b4e99b76aa8b
Anthony Russo,"Action, Adventure, Sci-Fi",7.7,"As Steve Rogers struggles to embrace his role in the modern world, he teams up with a fellow Avenger and S.H.I.E.L.D agent, Black Widow, to battle a new threat from history: an assassin known as the Winter Soldier.","https://m.media-amazon.com/images/M/MV5BMzA2NDkwODAwM15BMl5BanBnXkFtZTgwODk5MTgzMTE@._V1_UY98_CR0,0,67,98_AL_.jpg",2014,136 min,Captain America: The Winter Soldier,Joe Russo,Chris Evans,Samuel L. Jackson,Scarlett Johansson,646bbde4cbb1b4e99b76aa8c
Imtiaz Ali,"Drama, Music, Musical",7.7,"Janardhan Jakhar chases his dreams of becoming a big Rock star, during which he falls in love with Heer.","https://m.media-amazon.com/images/M/MV5BOTc3NzAxMjg4M15BMl5BanBnXkFtZTcwMDc2ODQwNw@@._V1_UY98_CR3,0,67,98_AL_.jpg",2011,159 min,Rockstar,Ranbir Kapoor,Nargis Fakhri,Shammi Kapoor,Kumud Mishra,646bbde4cbb1b4e99b76aa8d
Alexander Payne,"Adventure, Comedy, Drama",7.7,"An aging, booze-addled father makes the trip from Montana to Nebraska with his estranged son in order to claim a million-dollar Mega Sweepstakes Marketing prize.","https://m.media-amazon.com/images/M/MV5BOGQzODdlMDktNzU4ZC00N2M3LWFkYTAtYTM1NTE0ZWI5YTg4XkEyXkFqcGdeQXVyMTA1NTM1NDI2._V1_UX67_CR0,0,67,98_AL_.jpg",2013,115 min,Nebraska,Bruce Dern,Will Forte,June Squibb,Bob Odenkirk,646bbde4cbb1b4e99b76aa8e
Rich Moore,"Animation, Adventure, Comedy",7.7,"A video game villain wants to be a hero and sets out to fulfill his dream, but his quest brings havoc to the whole arcade where he lives.","https://m.media-amazon.com/images/M/MV5BNzMxNTExOTkyMF5BMl5BanBnXkFtZTcwMzEyNDc0OA@@._V1_UX67_CR0,0,67,98_AL_.jpg",2012,101 min,Wreck-It Ralph,John C. Reilly,Jack McBrayer,Jane Lynch,Sarah Silverman,646bbde4cbb1b4e99b76aa8f
Mark Osborne,"Animation, Adventure, Drama",7.7,"A little girl lives in a very grown-up world with her mother, who tries to prepare her for it. Her neighbor, the Aviator, introduces the girl to an extraordinary world where anything is possible, the world of the Little Prince.","https://m.media-amazon.com/images/M/MV5BNjg0OTM5OTQyNV5BMl5BanBnXkFtZTgwNDg5NDQ0NTE@._V1_UY98_CR2,0,67,98_AL_.jpg",2015,108 min,Le Petit Prince,Jeff Bridges,Mackenzie Foy,Rachel McAdams,Marion Cotillard,646bbde4cbb1b4e99b76aa90
Tony Kaye,Drama,7.7,A substitute teacher who drifts from classroom to classroom finds a connection to the students and teachers during his latest assignment.,"https://m.media-amazon.com/images/M/MV5BMTM3NzQzMDA5Ml5BMl5BanBnXkFtZTcwODA5NTcyNw@@._V1_UY98_CR0,0,67,98_AL_.jpg",2011,98 min,Detachment,Adrien Brody,Christina Hendricks,Marcia Gay Harden,Lucy Liu,646bbde4cbb1b4e99b76aa91
Woody Allen,"Comedy, Fantasy, Romance",7.7,"While on a trip to Paris with his fiancée's family, a nostalgic screenwriter finds himself mysteriously going back to the 1920s every day at midnight.","https://m.media-amazon.com/images/M/MV5BMTM4NjY1MDQwMl5BMl5BanBnXkFtZTcwNTI3Njg3NA@@._V1_UX67_CR0,0,67,98_AL_.jpg",2011,96 min,Midnight in Paris,Owen Wilson,Rachel McAdams,Kathy Bates,Kurt Fuller,646bbde4cbb1b4e99b76aa92
Christopher Miller,"Animation, Action, Adventure",7.7,"An ordinary LEGO construction worker, thought to be the prophesied as ""special"", is recruited to join a quest to stop an evil tyrant from gluing the LEGO universe into eternal stasis.","https://m.media-amazon.com/images/M/MV5BMTg4MDk1ODExN15BMl5BanBnXkFtZTgwNzIyNjg3MDE@._V1_UX67_CR0,0,67,98_AL_.jpg",2014,100 min,The Lego Movie,Phil Lord,Chris Pratt,Will Ferrell,Elizabeth Banks,646bbde4cbb1b4e99b76aa93
Alfonso Cuarón,"Drama, Sci-Fi, Thriller",7.7,Two astronauts work together to survive after an accident leaves them stranded in space.,"https://m.media-amazon.com/images/M/MV5BNjE5MzYwMzYxMF5BMl5BanBnXkFtZTcwOTk4MTk0OQ@@._V1_UX67_CR0,0,67,98_AL_.jpg",2013,91 min,Gravity,Sandra Bullock,George Clooney,Ed Harris,Orto Ignatiussen,646bbde4cbb1b4e99b76aa94
J.J. Abrams,"Action, Adventure, Sci-Fi",7.7,"After the crew of the Enterprise find an unstoppable force of terror from within their own organization, Captain Kirk leads a manhunt to a war-zone world to capture a one-man weapon of mass destruction.","https://m.media-amazon.com/images/M/MV5BMTk2NzczOTgxNF5BMl5BanBnXkFtZTcwODQ5ODczOQ@@._V1_UX67_CR0,0,67,98_AL_.jpg",2013,132 min,Star Trek Into Darkness,Chris Pine,Zachary Quinto,Zoe Saldana,Benedict Cumberbatch,646bbde4cbb1b4e99b76aa95
Cary Joji Fukunaga,"Drama, War",7.7,"A drama based on the experiences of Agu, a child soldier fighting in the civil war of an unnamed African country.","https://m.media-amazon.com/images/M/MV5BMTYwMzMzMDI0NF5BMl5BanBnXkFtZTgwNDQ3NjI3NjE@._V1_UX67_CR0,0,67,98_AL_.jpg",2015,137 min,Beasts of No Nation,Abraham Attah,Emmanuel Affadzi,Ricky Adelayitor,Andrew Adote,646bbde4cbb1b4e99b76aa96
David Fincher,"Biography, Drama",7.7,"As Harvard student Mark Zuckerberg creates the social networking site that would become known as Facebook, he is sued by the twins who claimed he stole their idea, and by the co-founder who was later squeezed out of the business.","https://m.media-amazon.com/images/M/MV5BOGUyZDUxZjEtMmIzMC00MzlmLTg4MGItZWJmMzBhZjE0Mjc1XkEyXkFqcGdeQXVyMTMxODk2OTU@._V1_UX67_CR0,0,67,98_AL_.jpg",2010,120 min,The Social Network,Jesse Eisenberg,Andrew Garfield,Justin Timberlake,Rooney Mara,646bbde4cbb1b4e99b76aa97
Matthew Vaughn,"Action, Adventure, Sci-Fi",7.7,"In the 1960s, superpowered humans Charles Xavier and Erik Lensherr work together to find others like them, but Erik's vengeful pursuit of an ambitious mutant who ruined his life causes a schism to divide them.","https://m.media-amazon.com/images/M/MV5BMTg5OTMxNzk4Nl5BMl5BanBnXkFtZTcwOTk1MjAwNQ@@._V1_UX67_CR0,0,67,98_AL_.jpg",2011,131 min,X: First Class,James McAvoy,Michael Fassbender,Jennifer Lawrence,Kevin Bacon,646bbde4cbb1b4e99b76aa98
Todd Phillips,Comedy,7.7,"Three buddies wake up from a bachelor party in Las Vegas, with no memory of the previous night and the bachelor missing. They make their way around the city in order to find their friend before his wedding.","https://m.media-amazon.com/images/M/MV5BNGQwZjg5YmYtY2VkNC00NzliLTljYTctNzI5NmU3MjE2ODQzXkEyXkFqcGdeQXVyNzkwMjQ5NzM@._V1_UX67_CR0,0,67,98_AL_.jpg",2009,100 min,The Hangover,Zach Galifianakis,Bradley Cooper,Justin Bartha,Ed Helms,646bbde4cbb1b4e99b76aa99
Sam Mendes,"Action, Adventure, Thriller",7.7,"James Bond's loyalty to M is tested when her past comes back to haunt her. When MI6 comes under attack, 007 must track down and destroy the threat, no matter how personal the cost.","https://m.media-amazon.com/images/M/MV5BMWZiNjE2OWItMTkwNy00ZWQzLWI0NTgtMWE0NjNiYTljN2Q1XkEyXkFqcGdeQXVyNzAwMjYxMzA@._V1_UX67_CR0,0,67,98_AL_.jpg",2012,143 min,Skyfall,Daniel Craig,Javier Bardem,Naomie Harris,Judi Dench,646bbde4cbb1b4e99b76aa9a
David O. Russell,"Comedy, Drama, Romance",7.7,"After a stint in a mental institution, former teacher Pat Solitano moves back in with his parents and tries to reconcile with his ex-wife. Things get more challenging when Pat meets Tiffany, a mysterious girl with problems of her own.","https://m.media-amazon.com/images/M/MV5BMTM2MTI5NzA3MF5BMl5BanBnXkFtZTcwODExNTc0OA@@._V1_UX67_CR0,0,67,98_AL_.jpg",2012,122 min,Silver Linings Playbook,Bradley Cooper,Jennifer Lawrence,Robert De Niro,Jacki Weaver,646bbde4cbb1b4e99b76aa9b
Ben Affleck,"Biography, Drama, Thriller",7.7,"Acting under the cover of a Hollywood producer scouting a location for a science fiction film, a CIA agent launches a dangerous operation to rescue six Americans in Tehran during the U.S. hostage crisis in Iran in 1979.","https://m.media-amazon.com/images/M/MV5BNzljNjY3MDYtYzc0Ni00YjU0LWIyNDUtNTE0ZDRiMGExMjZlXkEyXkFqcGdeQXVyMTMxODk2OTU@._V1_UX67_CR0,0,67,98_AL_.jpg",2012,120 min,Argo,Ben Affleck,Bryan Cranston,John Goodman,Alan Arkin,646bbde4cbb1b4e99b76aa9c
Marc Webb,"Comedy, Drama, Romance",7.7,"An offbeat romantic comedy about a woman who doesn't believe true love exists, and the young man who falls for her.","https://m.media-amazon.com/images/M/MV5BMTk5MjM4OTU1OV5BMl5BanBnXkFtZTcwODkzNDIzMw@@._V1_UX67_CR0,0,67,98_AL_.jpg",2009,95 min,(500) Days of Summer,Zooey Deschanel,Joseph Gordon-Levitt,Geoffrey Arend,Chloë Grace Moretz,646bbde4cbb1b4e99b76aa9d
David Yates,"Adventure, Family, Fantasy",7.7,"As Harry, Ron, and Hermione race against time and evil to destroy the Horcruxes, they uncover the existence of the three most powerful objects in the wizarding world: the Deathly Hallows.","https://m.media-amazon.com/images/M/MV5BMTQ2OTE1Mjk0N15BMl5BanBnXkFtZTcwODE3MDAwNA@@._V1_UX67_CR0,0,67,98_AL_.jpg",2010,146 min,Harry Potter and the Deathly Hallows: Part 1,Daniel Radcliffe,Emma Watson,Rupert Grint,Bill Nighy,646bbde4cbb1b4e99b76aa9e
Hayao Miyazaki,"Animation, Adventure, Comedy",7.7,"A five-year-old boy develops a relationship with Ponyo, a young goldfish princess who longs to become a human after falling in love with him.","https://m.media-amazon.com/images/M/MV5BOTc3YmM3N2QtODZkMC00ZDE5LThjMTQtYTljN2Y1YTYwYWJkXkEyXkFqcGdeQXVyODEzNjM5OTQ@._V1_UX67_CR0,0,67,98_AL_.jpg",2008,101 min,Gake no ue no Ponyo,Cate Blanchett,Matt Damon,Liam Neeson,Tomoko Yamaguchi,646bbde4cbb1b4e99b76aa9f
Ron Howard,"Biography, Drama, History",7.7,A dramatic retelling of the post-Watergate television interviews between British talk-show host David Frost and former president Richard Nixon.,"https://m.media-amazon.com/images/M/MV5BOTY4NTU2NTU4NF5BMl5BanBnXkFtZTcwNjE0OTc5MQ@@._V1_UX67_CR0,0,67,98_AL_.jpg",2008,122 min,Frost/Nixon,Frank Langella,Michael Sheen,Kevin Bacon,Sam Rockwell,646bbde4cbb1b4e99b76aaa0
Satoshi Kon,"Animation, Drama, Fantasy",7.7,"When a machine that allows therapists to enter their patients' dreams is stolen, all Hell breaks loose. Only a young female therapist, Paprika, can stop it.","https://m.media-amazon.com/images/M/MV5BNDliMTMxOWEtODM3Yi00N2QwLTg4YTAtNTE5YzBlNTA2NjhlXkEyXkFqcGdeQXVyNjE5MjUyOTM@._V1_UX67_CR0,0,67,98_AL_.jpg",2006,90 min,Papurika,Megumi Hayashibara,Tôru Emori,Katsunosuke Hori,Tôru Furuya,646bbde4cbb1b4e99b76aaa1
Clint Eastwood,"Biography, Crime, Drama",7.7,Grief-stricken mother Christine Collins (Angelina Jolie) takes on the L.A.P.D. to her own detriment when it tries to pass off an obvious impostor as her missing child.,"https://m.media-amazon.com/images/M/MV5BOTA1Mzg3NjIxNV5BMl5BanBnXkFtZTcwNzU2NTc5MQ@@._V1_UX67_CR0,0,67,98_AL_.jpg",2008,141 min,Changeling,Angelina Jolie,Colm Feore,Amy Ryan,Gattlin Griffith,646bbde4cbb1b4e99b76aaa2
Rob Reiner,"Comedy, Drama, Romance",7.7,Two eighth-graders start to have feelings for each other despite being total opposites.,"https://m.media-amazon.com/images/M/MV5BMTU2NjQ1Nzc4MF5BMl5BanBnXkFtZTcwNTM0NDk1Mw@@._V1_UX67_CR0,0,67,98_AL_.jpg",2010,90 min,Flipped,Madeline Carroll,Callan McAuliffe,Rebecca De Mornay,Anthony Edwards,646bbde4cbb1b4e99b76aaa3
Mamoru Hosoda,"Animation, Adventure, Comedy",7.7,"A high-school girl named Makoto acquires the power to travel back in time, and decides to use it for her own personal benefits. Little does she know that she is affecting the lives of others just as much as she is her own.","https://m.media-amazon.com/images/M/MV5BMzA4ZGM1NjYtMjcxYS00MTdiLWJmNzEtMTUzODY0NDQ0YzUzXkEyXkFqcGdeQXVyMzYwMjQ3OTI@._V1_UY98_CR1,0,67,98_AL_.jpg",2006,98 min,Toki o kakeru shôjo,Riisa Naka,Takuya Ishida,Mitsutaka Itakura,Ayami Kakiuchi,646bbde4cbb1b4e99b76aaa4
Shûsuke Kaneko,"Crime, Drama, Fantasy",7.7,"A battle between the world's two greatest minds begins when Light Yagami finds the Death Note, a notebook with the power to kill, and decides to rid the world of criminals.","https://m.media-amazon.com/images/M/MV5BZDNlNjEzMzQtZDM0MS00YzhiLTk0MGUtYTdmNDZiZGVjNTk0L2ltYWdlXkEyXkFqcGdeQXVyNTAyODkwOQ@@._V1_UY98_CR1,0,67,98_AL_.jpg",2006,126 min,Death Note: Desu nôto,Tatsuya Fujiwara,"Ken'ichi Matsuyama",Asaka Seto,Yû Kashii,646bbde4cbb1b4e99b76aaa5
Shane Meadows,"Crime, Drama",7.7,"A young boy becomes friends with a gang of skinheads. Friends soon become like family, and relationships will be pushed to the very limit.","https://m.media-amazon.com/images/M/MV5BMmE3OWZhZDYtOTBjMi00NDIwLTg1NWMtMjg0NjJmZWM4MjliL2ltYWdlXkEyXkFqcGdeQXVyNTAyODkwOQ@@._V1_UX67_CR0,0,67,98_AL_.jpg",2006,101 min,This Is England,Thomas Turgoose,Stephen Graham,Jo Hartley,Andrew Shim,646bbde4cbb1b4e99b76aaa6
Alex Garland,"Drama, Sci-Fi, Thriller",7.7,A young programmer is selected to participate in a ground-breaking experiment in synthetic intelligence by evaluating the human qualities of a highly advanced humanoid A.I.,"https://m.media-amazon.com/images/M/MV5BMTUxNzc0OTIxMV5BMl5BanBnXkFtZTgwNDI3NzU2NDE@._V1_UX67_CR0,0,67,98_AL_.jpg",2014,108 min,Ex Machina,Alicia Vikander,Domhnall Gleeson,Oscar Isaac,Sonoya Mizuno,646bbde4cbb1b4e99b76aaa7
Susanne Bier,Drama,7.7,"A manager of an orphanage in India is sent to Copenhagen, Denmark, where he discovers a life-altering family secret.","https://m.media-amazon.com/images/M/MV5BMjIxODEyOTQ5Ml5BMl5BanBnXkFtZTcwNjE3NzI5Mw@@._V1_UY98_CR1,0,67,98_AL_.jpg",2006,120 min,Efter brylluppet,Mads Mikkelsen,Sidse Babett Knudsen,Rolf Lassgård,Neeral Mulchandani,646bbde4cbb1b4e99b76aaa8
Kevin Macdonald,"Biography, Drama, History",7.7,"Based on the events of the brutal Ugandan dictator Idi Amin's regime as seen by his personal physician during the 1970s.","https://m.media-amazon.com/images/M/MV5BMjM1NTkxNjkzMl5BMl5BanBnXkFtZTgwNDgwMDAxMzE@._V1_UY98_CR1,0,67,98_AL_.jpg",2006,123 min,The Last King of Scotland,James McAvoy,Forest Whitaker,Gillian Anderson,Kerry Washington,646bbde4cbb1b4e99b76aaa9
David Fincher,"Crime, Drama, Mystery",7.7,"In the late 1960s/early 1970s, a San Francisco cartoonist becomes an amateur detective obsessed with tracking down the Zodiac Killer, an unidentified individual who terrorizes Northern California with a killing spree.","https://m.media-amazon.com/images/M/MV5BN2UwNDc5NmEtNjVjZS00OTI5LWE5YjctMWM3ZjBiZGYwMGI2XkEyXkFqcGdeQXVyNzkwMjQ5NzM@._V1_UX67_CR0,0,67,98_AL_.jpg",2007,157 min,Zodiac,Jake Gyllenhaal,Robert Downey Jr.,Mark Ruffalo,Anthony Edwards,646bbde4cbb1b4e99b76aaaa
Paul McGuigan,"Action, Crime, Drama",7.7,"A case of mistaken identity lands Slevin into the middle of a war being plotted by two of the city's most rival crime bosses. Under constant surveillance by Detective Brikowski and assassin Goodkat, he must get them before they get him.","https://m.media-amazon.com/images/M/MV5BZjczMWI1YWMtYTZjOS00ZDc5LWE2MWItMTY3ZGUxNzFkNjJmL2ltYWdlXkEyXkFqcGdeQXVyNjU0OTQ0OTY@._V1_UX67_CR0,0,67,98_AL_.jpg",2006,110 min,Lucky Number Slevin,Josh Hartnett,Ben Kingsley,Morgan Freeman,Lucy Liu,646bbde4cbb1b4e99b76aaab
Christian Carion,"Drama, History, Music",7.7,"In December 1914, an unofficial Christmas truce on the Western Front allows soldiers from opposing sides of the First World War to gain insight into each other's way of life.","https://m.media-amazon.com/images/M/MV5BMTQyODczNjU3NF5BMl5BanBnXkFtZTcwNjQ0NDIzMQ@@._V1_UX67_CR0,0,67,98_AL_.jpg",2005,116 min,Joyeux Noël,Diane Kruger,Benno Fürmann,Guillaume Canet,Natalie Dessay,646bbde4cbb1b4e99b76aaac
Anton Corbijn,"Biography, Drama, Music",7.7,"A profile of Ian Curtis, the enigmatic singer of Joy Division whose personal, professional, and romantic troubles led him to commit suicide at the age of 23.","https://m.media-amazon.com/images/M/MV5BNTEzOTYwMTcxN15BMl5BanBnXkFtZTcwNTgyNjI1MQ@@._V1_UX67_CR0,0,67,98_AL_.jpg",2007,122 min,Control,Sam Riley,Samantha Morton,Craig Parkinson,Alexandra Maria Lara,646bbde4cbb1b4e99b76aaad
Nathan Greno,"Animation, Adventure, Comedy",7.7,"The magically long-haired Rapunzel has spent her entire life in a tower, but now that a runaway thief has stumbled upon her, she is about to discover the world for the first time, and who she really is.","https://m.media-amazon.com/images/M/MV5BMTAxNDYxMjg0MjNeQTJeQWpwZ15BbWU3MDcyNTk2OTM@._V1_UX67_CR0,0,67,98_AL_.jpg",2010,100 min,Tangled,Byron Howard,Mandy Moore,Zachary Levi,Donna Murphy,646bbde4cbb1b4e99b76aaae
