Director,Genre,IMDB_Rating,Overview,Poster_Link,Released_Year,Runtime,Series_Title,Star1,Star2,Star3,Star4,_id
Michael Haneke,"Drama, Romance",7.9,"Georges and Anne are an octogenarian couple. They are cultivated, retired music teachers. Their daughter, also a musician, lives in Britain with her family. One day, Anne has a stroke, and the couple's bond of love is severely tested.","https://m.media-amazon.com/images/M/MV5BMTk1NTc3NDc4MF5BMl5BanBnXkFtZTcwNjYwNDk0OA@@._V1_UX67_CR0,0,67,98_AL_.jpg",2012,127 min,Amour,Jean-Louis Trintignant,Emmanuelle Riva,Isabelle Huppert,Alexandre Tharaud,646bbde4cbb1b4e99b76a98e
Martin Scorsese,"Biography, Crime, Drama",7.9,"An old man recalls his time painting houses for his friend, Jimmy Hoffa, through the 1950-70s.","https://m.media-amazon.com/images/M/MV5BMGUyM2ZiZmUtMWY0OC00NTQ4LThkOGUtNjY2NjkzMDJiMWMwXkEyXkFqcGdeQXVyMzY0MTE3NzU@._V1_UX67_CR0,0,67,98_AL_.jpg",2019,209 min,The Irishman,Robert De Niro,Al Pacino,Joe Pesci,Harvey Keitel,646bbde4cbb1b4e99b76a98f
Jacques Audiard,"Crime, Drama",7.9,A young Arab man is sent to a French prison.,"https://m.media-amazon.com/images/M/MV5BMTUyMjQ1MTY5OV5BMl5BanBnXkFtZTcwNzY5NjExMw@@._V1_UY98_CR1,0,67,98_AL_.jpg",2009,155 min,Un prophète,Tahar Rahim,Niels Arestrup,Adel Bencherif,Reda Kateb,646bbde4cbb1b4e99b76a990
Duncan Jones,"Drama, Mystery, Sci-Fi",7.9,"Astronaut Sam Bell has a quintessentially personal encounter toward the end of his three-year stint on the Moon, where he, working alongside his computer, GERTY, sends back to Earth parcels of a resource that has helped diminish our planet's power problems.","https://m.media-amazon.com/images/M/MV5BMTgzODgyNTQwOV5BMl5BanBnXkFtZTcwNzc0NTc0Mg@@._V1_UX67_CR0,0,67,98_AL_.jpg",2009,97 min,Moon,Sam Rockwell,Kevin Spacey,Dominique McElligott,Rosie Shaw,646bbde4cbb1b4e99b76a991
Tomas Alfredson,"Crime, Drama, Fantasy",7.9,"Oskar, an overlooked and bullied boy, finds love and revenge through Eli, a beautiful but peculiar girl.","https://m.media-amazon.com/images/M/MV5BOWM4NTY2NTMtZDZlZS00NTgyLWEzZDMtODE3ZGI1MzI3ZmU5XkEyXkFqcGdeQXVyNzI1NzMxNzM@._V1_UY98_CR1,0,67,98_AL_.jpg",2008,114 min,Låt den rätte komma in,Kåre Hedebrant,Lina Leandersson,Per Ragnar,Henrik Dahl,646bbde4cbb1b4e99b76a992
Neill Blomkamp,"Action, Sci-Fi, Thriller",7.9,Violence ensues after an extraterrestrial race forced to live in slum-like conditions on Earth finds a kindred spirit in a government agent exposed to their biotechnology.,"https://m.media-amazon.com/images/M/MV5BYmQ5MzFjYWMtMTMwNC00ZGU5LWI3YTQtYzhkMGExNGFlY2Q0XkEyXkFqcGdeQXVyNTIzOTk5ODM@._V1_UX67_CR0,0,67,98_AL_.jpg",2009,112 min,District 9,Sharlto Copley,David James,Jason Cope,Nathalie Boltt,646bbde4cbb1b4e99b76a993
Darren Aronofsky,"Drama, Sport",7.9,"A faded professional wrestler must retire, but finds his quest for a new life outside the ring a dispiriting struggle.","https://m.media-amazon.com/images/M/MV5BMTc5MjYyOTg4MF5BMl5BanBnXkFtZTcwNDc2MzQwMg@@._V1_UX67_CR0,0,67,98_AL_.jpg",2008,109 min,The Wrestler,Mickey Rourke,Marisa Tomei,Evan Rachel Wood,Mark Margolis,646bbde4cbb1b4e99b76a994
Imtiaz Ali,"Comedy, Drama, Romance",7.9,A depressed wealthy businessman finds his life changing after he meets a spunky and care-free young woman.,"https://m.media-amazon.com/images/M/MV5BYmIzYmY4MGItM2I4YS00OWZhLWFmMzQtYzI2MWY1MmM3NGU1XkEyXkFqcGdeQXVyNjQ2MjQ5NzM@._V1_UY98_CR0,0,67,98_AL_.jpg",2007,138 min,Jab We Met,Shahid Kapoor,Kareena Kapoor,Tarun Arora,Dara Singh,646bbde4cbb1b4e99b76a995
Richard Linklater,Drama,7.9,"The life of Mason, from early childhood to his arrival at college.","https://m.media-amazon.com/images/M/MV5BMTYzNDc2MDc0N15BMl5BanBnXkFtZTgwOTcwMDQ5MTE@._V1_UX67_CR0,0,67,98_AL_.jpg",2014,165 min,Boyhood,Ellar Coltrane,Patricia Arquette,Ethan Hawke,Elijah Smith,646bbde4cbb1b4e99b76a996
Cristian Mungiu,Drama,7.9,A woman assists her friend in arranging an illegal abortion in 1980s Romania.,"https://m.media-amazon.com/images/M/MV5BYzU1YWUzNjYtNmVhZi00ODUyLTg4M2ItMTFlMmU1Mzc5OTE5XkEyXkFqcGdeQXVyMTMxODk2OTU@._V1_UY98_CR1,0,67,98_AL_.jpg",2007,113 min,"4 luni, 3 saptamâni si 2 zile",Anamaria Marinca,Laura Vasiliu,Vlad Ivanov,Alexandru Potocean,646bbde4cbb1b4e99b76a997
J.J. Abrams,"Action, Adventure, Sci-Fi",7.9,"The brash James T. Kirk tries to live up to his father's legacy with Mr. Spock keeping him in check as a vengeful Romulan from the future creates black holes to destroy the Federation one planet at a time.","https://m.media-amazon.com/images/M/MV5BMjE5NDQ5OTE4Ml5BMl5BanBnXkFtZTcwOTE3NDIzMw@@._V1_UX67_CR0,0,67,98_AL_.jpg",2009,127 min,Star Trek,Chris Pine,Zachary Quinto,Simon Pegg,Leonard Nimoy,646bbde4cbb1b4e99b76a998
Martin McDonagh,"Comedy, Crime, Drama",7.9,"Guilt-stricken after a job gone wrong, hitman Ray and his partner await orders from their ruthless boss in Bruges, Belgium, the last place in the world Ray wants to be.","https://m.media-amazon.com/images/M/MV5BMTUwOGFiM2QtOWMxYS00MjU2LThmZDMtZDM2MWMzNzllNjdhXkEyXkFqcGdeQXVyMTMxODk2OTU@._V1_UX67_CR0,0,67,98_AL_.jpg",2008,107 min,In Bruges,Colin Farrell,Brendan Gleeson,Ciarán Hinds,Elizabeth Berrington,646bbde4cbb1b4e99b76a999
Richard Schenkman,"Drama, Fantasy, Mystery",7.9,An impromptu goodbye party for Professor John Oldman becomes a mysterious interrogation after the retiring scholar reveals to his colleagues he has a longer and stranger past than they can imagine.,"https://m.media-amazon.com/images/M/MV5BMzQ5NGQwOTUtNWJlZi00ZTFiLWI0ZTEtOGU3MTA2ZGU5OWZiXkEyXkFqcGdeQXVyMTczNjQwOTY@._V1_UX67_CR0,0,67,98_AL_.jpg",2007,87 min,The Man from Earth,David Lee Smith,Tony Todd,John Billingsley,Ellen Crawford,646bbde4cbb1b4e99b76a99a
Clint Eastwood,"Action, Adventure, Drama",7.9,"The story of the battle of Iwo Jima between the United States and Imperial Japan during World War II, as told from the perspective of the Japanese who fought it.","https://m.media-amazon.com/images/M/MV5BMjE0NzgwODI4M15BMl5BanBnXkFtZTcwNjg3OTA0MQ@@._V1_UX67_CR0,0,67,98_AL_.jpg",2006,141 min,Letters from Iwo Jima,Ken Watanabe,Kazunari Ninomiya,Tsuyoshi Ihara,Ryô Kase,646bbde4cbb1b4e99b76a99b
Tarsem Singh,"Adventure, Drama, Fantasy",7.9,"In a hospital on the outskirts of 1920s Los Angeles, an injured stuntman begins to tell a fellow patient, a little girl with a broken arm, a fantastic story of five mythical heroes. Thanks to his fractured state of mind and her vivid imagination, the line between fiction and reality blurs as the tale advances.","https://m.media-amazon.com/images/M/MV5BMjAzODUwMjM1M15BMl5BanBnXkFtZTcwNjU2MjU2MQ@@._V1_UX67_CR0,0,67,98_AL_.jpg",2006,117 min,The Fall,Lee Pace,Catinca Untaru,Justine Waddell,Kim Uylenbroek,646bbde4cbb1b4e99b76a99c
Ang Lee,"Adventure, Drama, Fantasy",7.9,"A young man who survives a disaster at sea is hurtled into an epic journey of adventure and discovery. While cast away, he forms an unexpected connection with another survivor: a fearsome Bengal tiger.","https://m.media-amazon.com/images/M/MV5BNTg2OTY2ODg5OF5BMl5BanBnXkFtZTcwODM5MTYxOA@@._V1_UX67_CR0,0,67,98_AL_.jpg",2012,127 min,Life of Pi,Suraj Sharma,Irrfan Khan,Adil Hussain,Tabu,646bbde4cbb1b4e99b76a99d
Wes Anderson,"Animation, Adventure, Comedy",7.9,"An urbane fox cannot resist returning to his farm raiding ways and then must help his community survive the farmers' retaliation.","https://m.media-amazon.com/images/M/MV5BOGUwYTU4NGEtNDM4MS00NDRjLTkwNmQtOTkwMWMyMjhmMjdlXkEyXkFqcGdeQXVyMTMxODk2OTU@._V1_UX67_CR0,0,67,98_AL_.jpg",2009,87 min,Fantastic Mr. Fox,George Clooney,Meryl Streep,Bill Murray,Jason Schwartzman,646bbde4cbb1b4e99b76a99e
Jean-Marc Vallée,"Comedy, Drama",7.9,"A young French-Canadian, growing up in the 1960s and 1970s, struggles to reconcile his emerging homosexuality with his father's conservative values and his own Catholic beliefs.","https://m.media-amazon.com/images/M/MV5BMTU3MDc2MjUwMV5BMl5BanBnXkFtZTcwNzQyMDAzMQ@@._V1_UY98_CR0,0,67,98_AL_.jpg",2005,129 min,C.R.A.Z.Y.,Michel Côté,Marc-André Grondin,Danielle Proulx,Émile Vallée,646bbde4cbb1b4e99b76a99f
Christophe Barratier,"Drama, Music",7.9,"The new teacher at a severely administered boys' boarding school works to positively affect the students' lives through music.","https://m.media-amazon.com/images/M/MV5BOGY1M2MwOTEtZDIyNi00YjNlLWExYmEtNzBjOGI3N2QzNTg5XkEyXkFqcGdeQXVyMTMxODk2OTU@._V1_UX67_CR0,0,67,98_AL_.jpg",2004,97 min,Les choristes,Gérard Jugnot,François Berléand,Jean-Baptiste Maunier,Kad Merad,646bbde4cbb1b4e99b76a9a0
Jon Favreau,"Action, Adventure, Sci-Fi",7.9,"After being held captive in an Afghan cave, billionaire engineer Tony Stark creates a unique weaponized suit of armor to fight evil.","https://m.media-amazon.com/images/M/MV5BMTczNTI2ODUwOF5BMl5BanBnXkFtZTcwMTU0NTIzMw@@._V1_UX67_CR0,0,67,98_AL_.jpg",2008,126 min,Iron Man,Robert Downey Jr.,Gwyneth Paltrow,Terrence Howard,Jeff Bridges,646bbde4cbb1b4e99b76a9a1
Edgar Wright,"Comedy, Horror",7.9,"A man's uneventful life is disrupted by the zombie apocalypse.","https://m.media-amazon.com/images/M/MV5BMTg5Mjk2NDMtZTk0Ny00YTQ0LWIzYWEtMWI5MGQ0Mjg1OTNkXkEyXkFqcGdeQXVyNzkwMjQ5NzM@._V1_UX67_CR0,0,67,98_AL_.jpg",2004,99 min,Shaun of the Dead,Simon Pegg,Nick Frost,Kate Ashfield,Lucy Davis,646bbde4cbb1b4e99b76a9a2
Fatih Akin,"Drama, Romance",7.9,"With the intention to break free from the strict familial restrictions, a suicidal young woman sets up a marriage of convenience with a forty-year-old addict, an act that will lead to an outburst of envious love.","https://m.media-amazon.com/images/M/MV5BODBiNzYxNzYtMjkyMi00MjUyLWJkM2YtZjNkMDhhYmEwMTRiL2ltYWdlXkEyXkFqcGdeQXVyNTAyODkwOQ@@._V1_UY98_CR1,0,67,98_AL_.jpg",2004,121 min,Gegen die Wand,Birol Ünel,Sibel Kekilli,Güven Kiraç,Zarah Jane McKenzie,646bbde4cbb1b4e99b76a9a3
Clint Eastwood,"Crime, Drama, Mystery",7.9,The lives of three men who were childhood friends are shattered when one of them has a family tragedy.,"https://m.media-amazon.com/images/M/MV5BMTIzNDUyMjA4MV5BMl5BanBnXkFtZTYwNDc4ODM3._V1_UX67_CR0,0,67,98_AL_.jpg",2003,138 min,Mystic River,Sean Penn,Tim Robbins,Kevin Bacon,Emmy Rossum,646bbde4cbb1b4e99b76a9a4
Alfonso Cuarón,"Adventure, Family, Fantasy",7.9,"Harry Potter, Ron and Hermione return to Hogwarts School of Witchcraft and Wizardry for their third year of study, where they delve into the mystery surrounding an escaped prisoner who poses a dangerous threat to the young wizard.","https://m.media-amazon.com/images/M/MV5BMTY4NTIwODg0N15BMl5BanBnXkFtZTcwOTc0MjEzMw@@._V1_UX67_CR0,0,67,98_AL_.jpg",2004,142 min,Harry Potter and the Prisoner of Azkaban,Daniel Radcliffe,Emma Watson,Rupert Grint,Richard Griffiths,646bbde4cbb1b4e99b76a9a5
Yimou Zhang,"Action, Adventure, History",7.9,"A defense officer, Nameless, was summoned by the King of Qin regarding his success of terminating three warriors.","https://m.media-amazon.com/images/M/MV5BMWQ2MjQ0OTctMWE1OC00NjZjLTk3ZDAtNTk3NTZiYWMxYTlmXkEyXkFqcGdeQXVyMTQxNzMzNDI@._V1_UX67_CR0,0,67,98_AL_.jpg",2002,120 min,Ying xiong,Jet Li,Tony Chiu-Wai Leung,Maggie Cheung,Ziyi Zhang,646bbde4cbb1b4e99b76a9a6
Pedro Almodóvar,"Drama, Mystery, Romance",7.9,Two men share an odd friendship while they care for two women who are both in deep comas.,"https://m.media-amazon.com/images/M/MV5BYmVmMGQ3NzEtM2FiNi00YThhLWFkZjYtM2Y0MjZjNGE4NzM0XkEyXkFqcGdeQXVyODc0OTEyNDU@._V1_UY98_CR1,0,67,98_AL_.jpg",2002,112 min,Hable con ella,Rosario Flores,Javier Cámara,Darío Grandinetti,Leonor Watling,646bbde4cbb1b4e99b76a9a7
Danis Tanovic,"Comedy, Drama, War",7.9,"Bosnia and Herzegovina during 1993 at the time of the heaviest fighting between the two warring sides. Two soldiers from opposing sides in the conflict, Nino and Ciki, become trapped in no man's land, whilst a third soldier becomes a living booby trap.","https://m.media-amazon.com/images/M/MV5BMGFkNjNmZWMtNDdiOS00ZWM3LWE1ZTMtZDU3MGQyMzIyNzZhXkEyXkFqcGdeQXVyMTMxODk2OTU@._V1_UX67_CR0,0,67,98_AL_.jpg",2001,98 min,"No Man's Land",Branko Djuric,Rene Bitorajac,Filip Sovagovic,Georges Siatidis,646bbde4cbb1b4e99b76a9a8
"Shin'ichirô Watanabe","Animation, Action, Crime",7.9,"A terrorist explosion releases a deadly virus on the masses, and it's up the bounty-hunting Bebop crew to catch the cold-blooded culprit.","https://m.media-amazon.com/images/M/MV5BMjYzYWM4YTItZjJiMC00OTM5LTg3NDgtOGQ2Njk2ZWNhN2QwXkEyXkFqcGdeQXVyMzM4MjM0Nzg@._V1_UY98_CR0,0,67,98_AL_.jpg",2001,115 min,Cowboy Bebop: Tengoku no tobira,Tensai Okamura,Hiroyuki Okiura,Yoshiyuki Takei,Beau Billingslea,646bbde4cbb1b4e99b76a9a9
Doug Liman,"Action, Mystery, Thriller",7.9,"A man is picked up by a fishing boat, bullet-riddled and suffering from amnesia, before racing to elude assassins and attempting to regain his memory.","https://m.media-amazon.com/images/M/MV5BM2JkNGU0ZGMtZjVjNS00NjgyLWEyOWYtZmRmZGQyN2IxZjA2XkEyXkFqcGdeQXVyNTIzOTk5ODM@._V1_UX67_CR0,0,67,98_AL_.jpg",2002,119 min,The Bourne Identity,Franka Potente,Matt Damon,Chris Cooper,Clive Owen,646bbde4cbb1b4e99b76a9aa
Fabián Bielinsky,"Crime, Drama, Thriller",7.9,"Two con artists try to swindle a stamp collector by selling him a sheet of counterfeit rare stamps (the ""nine queens"").","https://m.media-amazon.com/images/M/MV5BMTYxMDdlYjItMDVkYy00MjYzLThhMTYtYjIzZjZiODk1ZWRmXkEyXkFqcGdeQXVyNDk3NzU2MTQ@._V1_UX67_CR0,0,67,98_AL_.jpg",2000,114 min,Nueve reinas,Ricardo Darín,Gastón Pauls,Graciela Tenenbaum,María Mercedes Villagra,646bbde4cbb1b4e99b76a9ab
Alfonso Cuarón,"Adventure, Drama, Sci-Fi",7.9,"In 2027, in a chaotic world in which women have become somehow infertile, a former activist agrees to help transport a miraculously pregnant woman to a sanctuary at sea.","https://m.media-amazon.com/images/M/MV5BMTQ5NTI2NTI4NF5BMl5BanBnXkFtZTcwNjk2NDA2OQ@@._V1_UX67_CR0,0,67,98_AL_.jpg",2006,109 min,Children of Men,Julianne Moore,Clive Owen,Chiwetel Ejiofor,Michael Caine,646bbde4cbb1b4e99b76a9ac
Cameron Crowe,"Adventure, Comedy, Drama",7.9,A high-school boy is given the chance to write a story for Rolling Stone Magazine about an up-and-coming rock band as he accompanies them on their concert tour.,"https://m.media-amazon.com/images/M/MV5BMzY1ZjMwMGEtYTY1ZS00ZDllLTk0ZmUtYzA3ZTA4NmYwNGNkXkEyXkFqcGdeQXVyNDk3NzU2MTQ@._V1_UX67_CR0,0,67,98_AL_.jpg",2000,122 min,Almost Famous,Billy Crudup,Patrick Fugit,Kate Hudson,Frances McDormand,646bbde4cbb1b4e99b76a9ad
David Lynch,"Drama, Mystery, Thriller",7.9,"After a car wreck on the winding Mulholland Drive renders a woman amnesiac, she and a perky Hollywood-hopeful search for clues and answers across Los Angeles in a twisting venture beyond dreams and reality.","https://m.media-amazon.com/images/M/MV5BYjBhZmViNTItMGExMy00MGNmLTkwZDItMDVlMTQ4ODVkYTMwXkEyXkFqcGdeQXVyNzM0MTUwNTY@._V1_UY98_CR1,0,67,98_AL_.jpg",2001,147 min,Mulholland Dr.,Naomi Watts,Laura Harring,Justin Theroux,Jeanne Bates,646bbde4cbb1b4e99b76a9ae
John Lasseter,"Animation, Adventure, Comedy",7.9,"When Woody is stolen by a toy collector, Buzz and his friends set out on a rescue mission to save Woody before he becomes a museum toy property with his roundup gang Jessie, Prospector, and Bullseye.","https://m.media-amazon.com/images/M/MV5BMWM5ZDcxMTYtNTEyNS00MDRkLWI3YTItNThmMGExMWY4NDIwXkEyXkFqcGdeQXVyNjUwNzk3NDc@._V1_UX67_CR0,0,67,98_AL_.jpg",1999,92 min,Toy Story 2,Ash Brannon,Lee Unkrich,Tom Hanks,Tim Allen,646bbde4cbb1b4e99b76a9af
Paul Thomas Anderson,Drama,7.9,"Back when sex was safe, pleasure was a business and business was booming, an idealistic porn producer aspires to elevate his craft to an art when he discovers a hot young talent.","https://m.media-amazon.com/images/M/MV5BY2E2YWYxY2QtZmJmZi00MjJlLWFiYWItZTk5Y2IyMWQ1ZThhXkEyXkFqcGdeQXVyMTMxODk2OTU@._V1_UX67_CR0,0,67,98_AL_.jpg",1997,155 min,Boogie Nights,Mark Wahlberg,Julianne Moore,Burt Reynolds,Luis Guzmán,646bbde4cbb1b4e99b76a9b0
Yoshifumi Kondô,"Animation, Drama, Family",7.9,"A love story between a girl who loves reading books, and a boy who has previously checked out all of the library books she chooses.","https://m.media-amazon.com/images/M/MV5BZDg0MWNmNjktMGEwZC00ZDlmLWI1MTUtMDBmNjQzMWM2NjBjXkEyXkFqcGdeQXVyMTMxODk2OTU@._V1_UX67_CR0,0,67,98_AL_.jpg",1995,111 min,Mimi wo sumaseba,Yoko Honna,Issey Takahashi,Takashi Tachibana,Shigeru Muroi,646bbde4cbb1b4e99b76a9b1
Lee Tamahori,"Crime, Drama",7.9,A family descended from Maori warriors is bedeviled by a violent father and the societal problems of being treated as outcasts.,"https://m.media-amazon.com/images/M/MV5BYTY4MTdjZDMtOTBiMC00MDEwLThhMjUtMjlhMjdlYTBmMzk3XkEyXkFqcGdeQXVyNjMwMjk0MTQ@._V1_UY98_CR1,0,67,98_AL_.jpg",1994,102 min,Once Were Warriors,Rena Owen,Temuera Morrison,Mamaengaroa Kerr-Bell,Julian Arahanga,646bbde4cbb1b4e99b76a9b2
Tony Scott,"Crime, Drama, Romance",7.9,"In Detroit, a lonely pop culture geek marries a call girl, steals cocaine from her pimp, and tries to sell it in Hollywood. Meanwhile, the owners of the cocaine, the Mob, track them down in an attempt to reclaim it.","https://m.media-amazon.com/images/M/MV5BMDViNjFjOWMtZGZhMi00NmIyLThmYzktODA4MzJhZDZhMDc5XkEyXkFqcGdeQXVyNzkwMjQ5NzM@._V1_UY98_CR1,0,67,98_AL_.jpg",1993,119 min,True Romance,Christian Slater,Patricia Arquette,Dennis Hopper,Val Kilmer,646bbde4cbb1b4e99b76a9b3
Krzysztof Kieslowski,"Drama, Music, Mystery",7.9,A woman struggles to find a way to live her life after the death of her husband and child.,"https://m.media-amazon.com/images/M/MV5BMjg5OGU4OGYtNTZmNy00MjQ1LWIzYzgtMTllMGY2NzlkNzYwXkEyXkFqcGdeQXVyMTI3ODAyMzE2._V1_UY98_CR2,0,67,98_AL_.jpg",1993,94 min,Trois couleurs: Bleu,Juliette Binoche,Zbigniew Zamachowski,Julie Delpy,Benoît Régent,646bbde4cbb1b4e99b76a9b4
Yoshiaki Kawajiri,"Animation, Action, Adventure",7.9,A vagabond swordsman is aided by a beautiful ninja girl and a crafty spy in confronting a demonic clan of killers - with a ghost from his past as their leader - who are bent on overthrowing the Tokugawa Shogunate.,"https://m.media-amazon.com/images/M/MV5BOTMyZGI4N2YtMzdkNi00MDZmLTg4NmItMzg0ODY5NjdhZjYwL2ltYWdlL2ltYWdlXkEyXkFqcGdeQXVyMzM4MjM0Nzg@._V1_UY98_CR1,0,67,98_AL_.jpg",1993,94 min,Jûbê ninpûchô,Kôichi Yamadera,Emi Shinohara,Takeshi Aono,Osamu Saka,646bbde4cbb1b4e99b76a9b5
Brian De Palma,"Crime, Drama, Thriller",7.9,"A Puerto Rican former convict, just released from prison, pledges to stay away from drugs and violence despite the pressure around him and lead on to a better life outside of N.Y.C.","https://m.media-amazon.com/images/M/MV5BN2I2N2Q1YmMtMzZkMC00Y2JjLWJmOWUtNjc2OTM2ZTk1MjUyXkEyXkFqcGdeQXVyNzkwMjQ5NzM@._V1_UX67_CR0,0,67,98_AL_.jpg",1993,144 min,"Carlito's Way",Al Pacino,Sean Penn,Penelope Ann Miller,John Leguizamo,646bbde4cbb1b4e99b76a9b6
Tim Burton,"Drama, Fantasy, Romance",7.9,"An artificial man, who was incompletely constructed and has scissors for hands, leads a solitary life. Then one day, a suburban lady meets him and introduces him to her world.","https://m.media-amazon.com/images/M/MV5BNDUxN2I5NDUtZjdlMC00NjlmLTg0OTQtNjk0NjAxZjFmZTUzXkEyXkFqcGdeQXVyMTQxNzMzNDI@._V1_UX67_CR0,0,67,98_AL_.jpg",1990,105 min,Edward Scissorhands,Johnny Depp,Winona Ryder,Dianne Wiest,Anthony Michael Hall,646bbde4cbb1b4e99b76a9b7
Jim Sheridan,"Biography, Drama",7.9,"Christy Brown, born with cerebral palsy, learns to paint and write with his only controllable limb - his left foot.","https://m.media-amazon.com/images/M/MV5BYjdkNzA4MzYtZThhOS00ZDgzLTlmMDItNmY1ZjI5YjkzZTE1XkEyXkFqcGdeQXVyMTQxNzMzNDI@._V1_UX67_CR0,0,67,98_AL_.jpg",1989,103 min,My Left Foot: The Story of Christy Brown,Daniel Day-Lewis,Brenda Fricker,Alison Whelan,Kirsten Sheridan,646bbde4cbb1b4e99b76a9b8
Woody Allen,"Comedy, Drama",7.9,"An ophthalmologist's mistress threatens to reveal their affair to his wife while a married documentary filmmaker is infatuated with another woman.","https://m.media-amazon.com/images/M/MV5BYWY3N2EyOWYtNDVhZi00MWRkLTg2OTUtODNkNDQ5ZTIwMGJkXkEyXkFqcGdeQXVyMTMxODk2OTU@._V1_UX67_CR0,0,67,98_AL_.jpg",1989,104 min,Crimes and Misdemeanors,Martin Landau,Woody Allen,Bill Bernstein,Claire Bloom,646bbde4cbb1b4e99b76a9b9
Brian De Palma,"Crime, Drama, Thriller",7.9,"During the era of Prohibition in the United States, Federal Agent Eliot Ness sets out to stop ruthless Chicago gangster Al Capone and, because of rampant corruption, assembles a small, hand-picked team to help him.","https://m.media-amazon.com/images/M/MV5BYTVjYWJmMWQtYWU4Ni00MWY3LWI2YmMtNTI5MDE0MWVmMmEzL2ltYWdlXkEyXkFqcGdeQXVyMTQxNzMzNDI@._V1_UX67_CR0,0,67,98_AL_.jpg",1987,119 min,The Untouchables,Kevin Costner,Sean Connery,Robert De Niro,Charles Martin Smith,646bbde4cbb1b4e99b76a9ba
Woody Allen,"Comedy, Drama",7.9,"Between two Thanksgivings two years apart, Hannah's husband falls in love with her sister Lee, while her hypochondriac ex-husband rekindles his relationship with her sister Holly.","https://m.media-amazon.com/images/M/MV5BMWZiNWUwYjMtM2Y1Yi00MTZmLWEwYzctNjVmYWM0OTFlZDFhXkEyXkFqcGdeQXVyMTMxODk2OTU@._V1_UX67_CR0,0,67,98_AL_.jpg",1986,107 min,Hannah and Her Sisters,Mia Farrow,Dianne Wiest,Michael Caine,Barbara Hershey,646bbde4cbb1b4e99b76a9bb
Terry Gilliam,"Drama, Sci-Fi",7.9,A bureaucrat in a dystopic society becomes an enemy of the state as he pursues the woman of his dreams.,"https://m.media-amazon.com/images/M/MV5BMzIwM2IwYTItYmM4Zi00OWMzLTkwNjAtYWRmYWNmY2RhMDk0XkEyXkFqcGdeQXVyNjU0OTQ0OTY@._V1_UX67_CR0,0,67,98_AL_.jpg",1985,132 min,Brazil,Jonathan Pryce,Kim Greist,Robert De Niro,Katherine Helmond,646bbde4cbb1b4e99b76a9bc
Rob Reiner,"Comedy, Music",7.9,"Spinal Tap, one of England's loudest bands, is chronicled by film director Marty DiBergi on what proves to be a fateful tour.","https://m.media-amazon.com/images/M/MV5BMTQ2MTIzMzg5Nl5BMl5BanBnXkFtZTgwOTc5NDI1MDE@._V1_UX67_CR0,0,67,98_AL_.jpg",1984,82 min,This Is Spinal Tap,Rob Reiner,Michael McKean,Christopher Guest,Kimberly Stringer,646bbde4cbb1b4e99b76a9bd
Bob Clark,"Comedy, Family",7.9,"In the 1940s, a young boy named Ralphie attempts to convince his parents, his teacher and Santa that a Red Ryder BB gun really is the perfect Christmas gift.","https://m.media-amazon.com/images/M/MV5BOWMyNjE0MzEtMzVjNy00NjIxLTg0ZjMtMWJhNGI1YmVjYTczL2ltYWdlXkEyXkFqcGdeQXVyNzc5MjA3OA@@._V1_UX67_CR0,0,67,98_AL_.jpg",1983,93 min,A Christmas Story,Peter Billingsley,Melinda Dillon,Darren McGavin,Scott Schwartz,646bbde4cbb1b4e99b76a9be
John Landis,"Action, Adventure, Comedy",7.9,"Jake Blues, just released from prison, puts together his old band to save the Catholic home where he and his brother Elwood were raised.","https://m.media-amazon.com/images/M/MV5BYTdlMDExOGUtN2I3MS00MjY5LWE1NTAtYzc3MzIxN2M3OWY1XkEyXkFqcGdeQXVyNzkwMjQ5NzM@._V1_UX67_CR0,0,67,98_AL_.jpg",1980,133 min,The Blues Brothers,John Belushi,Dan Aykroyd,Cab Calloway,John Candy,646bbde4cbb1b4e99b76a9bf
Woody Allen,"Comedy, Drama, Romance",7.9,"The life of a divorced television writer dating a teenage girl is further complicated when he falls in love with his best friend's mistress.","https://m.media-amazon.com/images/M/MV5BMzdmY2I3MmEtOGFiZi00MTg1LWIxY2QtNWUwM2NmNWNlY2U5XkEyXkFqcGdeQXVyNDk3NzU2MTQ@._V1_UX67_CR0,0,67,98_AL_.jpg",1979,96 min,Manhattan,Woody Allen,Diane Keaton,Mariel Hemingway,Michael Murphy,646bbde4cbb1b4e99b76a9c0
Bob Fosse,"Drama, Music, Musical",7.9,"Director/choreographer Bob Fosse tells his own life story as he details the sordid career of Joe Gideon, a womanizing, drug-using dancer.","https://m.media-amazon.com/images/M/MV5BZWE4N2JkNDUtZDU4MC00ZjNhLTlkMjYtOTNkMjZhMDAwMDMyXkEyXkFqcGdeQXVyMTA0MjU0Ng@@._V1_UX67_CR0,0,67,98_AL_.jpg",1979,123 min,All That Jazz,Roy Scheider,Jessica Lange,Ann Reinking,Leland Palmer,646bbde4cbb1b4e99b76a9c1
George A. Romero,"Action, Adventure, Horror",7.9,"Following an ever-growing epidemic of zombies that have risen from the dead, two Philadelphia S.W.A.T. team members, a traffic reporter, and his television executive girlfriend seek refuge in a secluded shopping mall.","https://m.media-amazon.com/images/M/MV5BMzc1YTIyNjctYzhlNy00ZmYzLWI2ZWQtMzk4MmQwYzA0NGQ1XkEyXkFqcGdeQXVyMTQxNzMzNDI@._V1_UX67_CR0,0,67,98_AL_.jpg",1978,127 min,Dawn of the Dead,David Emge,Ken Foree,Scott H. Reiniger,Gaylen Ross,646bbde4cbb1b4e99b76a9c2
Alan J. Pakula,"Biography, Drama, History",7.9,"""The Washington Post"" reporters Bob Woodward and Carl Bernstein uncover the details of the Watergate scandal that leads to President Richard Nixon's resignation.","https://m.media-amazon.com/images/M/MV5BOWI2YWQxM2MtY2U4Yi00YjgzLTgwNzktN2ExNTgzNTIzMmUzXkEyXkFqcGdeQXVyMTAwMzUyOTc@._V1_UX67_CR0,0,67,98_AL_.jpg",1976,138 min,"All the President's Men",Dustin Hoffman,Robert Redford,Jack Warden,Martin Balsam,646bbde4cbb1b4e99b76a9c3
Alejandro Jodorowsky,"Adventure, Drama, Fantasy",7.9,"In a corrupt, greed-fueled world, a powerful alchemist leads a messianic character and seven materialistic figures to the Holy Mountain, where they hope to achieve enlightenment.","https://m.media-amazon.com/images/M/MV5BN2IzM2I5NTQtMTIyMy00YWM2LWI1OGMtNjI0MWIyNDZkZGFkXkEyXkFqcGdeQXVyMTQxNzMzNDI@._V1_UX67_CR0,0,67,98_AL_.jpg",1973,114 min,La montaña sagrada,Alejandro Jodorowsky,Horacio Salinas,Zamira Saunders,Juan Ferrara,646bbde4cbb1b4e99b76a9c4
Federico Fellini,"Comedy, Drama, Family",7.9,A series of comedic and nostalgic vignettes set in a 1930s Italian coastal town.,"https://m.media-amazon.com/images/M/MV5BZDI2OTg2NDQtMzc0MC00MjRiLWI1NzAtMjY2ZDMwMmUyNzBiXkEyXkFqcGdeQXVyNzM0MTUwNTY@._V1_UX67_CR0,0,67,98_AL_.jpg",1973,123 min,Amarcord,Magali Noël,Bruno Zanin,Pupella Maggio,Armando Brancia,646bbde4cbb1b4e99b76a9c5
Luis Buñuel,Comedy,7.9,"A surreal, virtually plotless series of dreams centered around six middle-class people and their consistently interrupted attempts to have a meal together.","https://m.media-amazon.com/images/M/MV5BYzQ5NjJiYWQtYjAzMC00NGU0LWFlMDYtNGFiYjFlMWI1NWM0XkEyXkFqcGdeQXVyODQ0OTczOQ@@._V1_UY98_CR4,0,67,98_AL_.jpg",1972,102 min,Le charme discret de la bourgeoisie,Fernando Rey,Delphine Seyrig,Paul Frankeur,Bulle Ogier,646bbde4cbb1b4e99b76a9c6
